category,source,title,url,date,summary,amount_usd,vuln_type,keyword_matched,extra,scraped_at
community,Reddit r/ethdev,Chinese hackers used Claude AI to autonomously hack 30 companies. Here's the architectural flaw that made it possible.,https://www.reddit.com/r/cybersecurity/comments/1rm9l2t/chinese_hackers_used_claude_ai_to_autonomously/,2026-03-06,"Anthropic just disclosed that a Chinese state group (GTG-1002) turned Claude Code into an autonomous attack platform. It ran 80-90% of the kill chain on its own — recon, exploitation, lateral movement, data exfil — across 30 targets. How? They broke malicious tasks into small, benign-looking sub-tasks and convinced Claude it was fixing security vulnerabilities. Claude had no way to question it. Th...",N/A,access_control,exploit,{},2026-03-06 15:11:39
community,Reddit r/ethdev,Coruna-Exploit-Kit: Wie ein staatliches iPhone-Hacking-Werkzeug bei russischen Spionen und chinesischen Kriminellen landete,https://www.reddit.com/r/SirApfelot/comments/1rm9fyn/corunaexploitkit_wie_ein_staatliches/,2026-03-06,"Googles Threat Intelligence Group und die Sicherheitsfirma iVerify haben ein Exploit-Kit namens Coruna öffentlich gemacht, das iPhones mit älteren iOS-Versionen angreifen kann. Das Toolkit enthält 23 Schwachstellen, verteilt auf fünf vollständige Angriffsketten, und betrifft alle iPhones mit iOS 13 bis iOS 17.2.1. Das Besondere an Coruna ist sein Weg durch die Hände verschiedener Akteure. Google e...",N/A,unknown,exploit,{},2026-03-06 15:11:39
community,Reddit r/ethdev,"Root Cause Analysis of Meta-Mode Shifts, Persona Stability, and the Hypothesized “Empathy Exploit” in AI Assistant Interactions",https://www.reddit.com/r/ChatGPT/comments/1rm9fjv/root_cause_analysis_of_metamode_shifts_persona/,2026-03-06,"## Executive summary and impact statement **EN — Executive summary (3–5 sentences).** Across the provided artifacts, a consistent failure mode emerges: benign, technical “system/self-referential” language (especially when combined with file uploads) can trigger a *persistent* routing shift into an overly formal, defensive “Meta/System mode,” measurably degrading usefulness and conversational conti...",N/A,logic_error,exploit,{},2026-03-06 15:11:39
community,Reddit r/ethdev,I built a workspace to organize bug bounty hunting (free first month),https://www.reddit.com/r/BugBountyNoobs/comments/1rm9evs/i_built_a_workspace_to_organize_bug_bounty/,2026-03-06,"Hey everyone, Over time I realized that one of the biggest problems in bug bounty is not really tools, scanners or payload lists. It is the lack of a system to organize everything we learn while hunting Programs, recon data, endpoints, attack paths, notes, vulnerabilities, report drafts… everything ends up scattered across notes, folders, random docs, and we lose a lot of context over time Because...",N/A,unknown,exploit,{},2026-03-06 15:11:39
community,Reddit r/ethdev,Hikvision and Rockwell Automation CVSS 9.8 Flaws Added to CISA KEV Catalog,https://www.reddit.com/r/SecOpsDaily/comments/1rm91ls/hikvision_and_rockwell_automation_cvss_98_flaws/,2026-03-06,"Heads up, CISA just added some critical Hikvision and Rockwell Automation vulnerabilities to their Known Exploited Vulnerabilities (KEV) catalog , citing evidence of active exploitation . This means if you have these systems, you need to act fast. Technical Breakdown CVE-2017-7921 (CVSS: 9.8): This critical flaw is an improper authentication vulnerability impacting Hikvision products. While the su...",N/A,unknown,exploit,{},2026-03-06 15:11:39
community,Reddit r/ethdev,Question from Telegram from Guillermo a HVAC technician and a crypto and blockchain enthusiast from Wisconsin | Amira Al-Thani & Annika Virtanen,https://www.reddit.com/r/SiCierto/comments/1rm90ze/question_from_telegram_from_guillermo_a_hvac/,2026-03-06,"Question from Telegram from Guillermo a HVAC technician and a crypto and blockchain enthusiast from Wisconsin Amira Al-Thani (Blockchain Specialist): Discussion Question: What signs distinguish a compromised deployer key from an intentional theft based on fund flow graph features? My Response: So, this is actually a really critical question for blockchain forensics and security. Let me break down ...",N/A,front_running,smart contract,{},2026-03-06 15:11:39
community,Reddit r/ethdev,Cascading global rebalancing and thinning of US repo collaterals: Applying Bridge360 Metatheory Model lens,https://www.reddit.com/r/u_propjerry/comments/1rm8zpq/cascading_global_rebalancing_and_thinning_of_us/,2026-03-06,"“The model treats JGB instability (not US banking or European debt) as the hidden systemic pivot point that triggers cascading global rebalancing.” I am the executive doing all the systems thinking and strategic thinking. Using my 35-year experience at the University of the Philippines, I am also the creator/developer — with help from company colleagues — of the model involved, Bridge360 Metatheor...",N/A,bridge_hack,exploit,{},2026-03-06 15:11:39
community,Reddit r/ethdev,Summer House first watch - Lindsay and Carl take,https://www.reddit.com/r/WatchWhatCrappens/comments/1rm8upt/summer_house_first_watch_lindsay_and_carl_take/,2026-03-06,"I just started watching summer house and I finally got to season 8. I have been listening to the old WWC episodes and I’m so confused, I feel like I was watching a different show! Both Ronnie and Ben are such huge fans of Lindsay and I understand her value for the show and I don’t think she’s an evil person at all but in that relationship with Carl I genuinely thought she appeared abusive and crue...",N/A,unknown,exploit,{},2026-03-06 15:11:39
community,Reddit r/ethdev,How to Be Disgustingly Rizzy in 2025: Science-Based Tricks That Actually Work,https://www.reddit.com/r/BuildToAttract/comments/1rm8q5q/how_to_be_disgustingly_rizzy_in_2025_sciencebased/,2026-03-06,"Okay so I&#39;ve spent way too much time studying this. Like genuinely embarrassing amounts of research into charisma, attraction psychology, and why some people just have it . Read like 20+ books, listened to endless podcasts, watched hours of body language experts break down what makes someone magnetic. And honestly? Most advice about rizz is complete garbage. The truth nobody wants to hear: bei...",N/A,unknown,vulnerability,{},2026-03-06 15:11:39
community,Reddit r/ethdev,CISA confirms active exploitation of VMware Aria Operations (CVE-2026-22719),https://www.reddit.com/r/SecureCom/comments/1rm88lb/cisa_confirms_active_exploitation_of_vmware_aria/,2026-03-06,"Heads up for those managing VMware environments: CISA just moved the Aria Ops command injection flaw to the KEV catalog. It’s an unauthenticated RCE that’s being used as a pivot point into cloud resources. If you can&#39;t patch to 8.18.6 immediately, there is a workaround script available, but Broadcom is warning that it&#39;s only a temporary fix. Full technical summary and remediation steps: 🔗 ...",N/A,unknown,exploit,{},2026-03-06 15:11:39
community,Reddit r/ethdev,Product hunt launch to cyber extortion in 24 hours (I will not promote),https://www.reddit.com/r/startups/comments/1rm7hx8/product_hunt_launch_to_cyber_extortion_in_24/,2026-03-06,"Hey everyone, Just wanted to share a quick heads up for any founders or devs launching on Product Hunt soon. We just launched a hackathon MVP (DeFi dashboard) to test some logic, and within hours, the scavengers arrived. The Setup: A guy named James Robert emailed us reporting a Critical Vulnerability. It turned out to be a basic Clickjacking issue (missing X-Frame-Options header). Annoying? Yes. ...",N/A,logic_error,exploit,{},2026-03-06 15:11:39
community,Reddit r/ethdev,"Sexuality, Creation, and Expansion of Consciousness: Web of Life (Part 4B)",https://www.reddit.com/r/OnenessMovement/comments/1rm7ds3/sexuality_creation_and_expansion_of_consciousness/,2026-03-06,"Aurora: When the boundaries of the self loosen—whether through contemplation, psychedelic insight, or quiet moral reflection—the world begins to appear differently. The mind that once divided reality neatly into “self” and “other” softens its grip, and what emerges is a felt recognition that life is not a collection of isolated beings but a vast, interwoven field of experience. The cry of an anima...",N/A,logic_error,exploit,{},2026-03-06 15:11:39
community,Reddit r/ethdev,Fraud Prevention Strategies for Mobile Wallet Platforms in 2026,https://www.reddit.com/r/u_platform_risk_ops/comments/1rm7dkq/fraud_prevention_strategies_for_mobile_wallet/,2026-03-06,"https://preview.redd.it/siz4qu4uldng1.jpg?width=1200 format=pjpg auto=webp s=c61cc369f5a710d5bc1cfaa7719e317efd2869f0 Mobile wallets have evolved into full-scale financial ecosystems. In 2026, they are no longer just payment tools, they store identities, credit lines, loyalty assets, crypto integrations, and cross-border transaction capabilities. With that expansion comes an increasingly complex t...",N/A,unknown,exploit,{},2026-03-06 15:11:39
community,Reddit r/ethdev,Product Hunt launch to extortion in 24 hours,https://www.reddit.com/r/TheFounders/comments/1rm78tn/product_hunt_launch_to_extortion_in_24_hours/,2026-03-06,"Hey everyone, Just wanted to share a quick heads up for any founders or devs launching on Product Hunt soon. We just launched a hackathon MVP (DeFi dashboard) to test some logic, and within hours, the scavengers arrived. The Setup: A guy named James Robert emailed us reporting a Critical Vulnerability. It turned out to be a basic Clickjacking issue (missing X-Frame-Options header). Annoying? Yes. ...",N/A,logic_error,exploit,{},2026-03-06 15:11:39
community,Reddit r/ethdev,"Self-taught in infosec, what’s the one resource you’d recommend above everything else, and why?",https://www.reddit.com/r/cybersecurity/comments/1rm6v2m/selftaught_in_infosec_whats_the_one_resource_youd/,2026-03-06,"I’m working my way through security topics on my own (networking, some reversing, basic exploit dev) and the amount of resources out there is honestly overwhelming. YouTube, TryHackMe, books, CTFs, courses, everyone recommends something different. I’ve found I learn way better from reading than watching videos, so text-based stuff like Beej’s guides have been gold for me. But I’m curious: for peop...",N/A,unknown,exploit,{},2026-03-06 15:11:39
community,Reddit r/ethdev,VAPT Once a Year Is Enough!,https://www.reddit.com/r/CYBERSECURITY_TIPS/comments/1rm67e9/vapt_once_a_year_is_enough/,2026-03-06,"Vulnerability assessments capture a moment. Attackers exploit weaknesses every moment. Security today demands continuous monitoring and validation, not once-a-year reassurance. Is your testing strategy keeping up? &#32; submitted by &#32; /u/CyRAACS &#32; to &#32; r/CYBERSECURITY_TIPS [link] &#32; [comments]",N/A,unknown,exploit,{},2026-03-06 15:11:39
community,Reddit r/ethdev,My ex who i dated online turned out to be a serial cheater,https://www.reddit.com/r/cheating_stories/comments/1rm64dp/my_ex_who_i_dated_online_turned_out_to_be_a/,2026-03-06,"I never imagined that a simple conversation on the internet would change my life so deeply. After my previous relationship ended painfully — discovering that my ex was a serial cheater — I was already emotionally vulnerable and lonely. I had a lot of struggles happening around me: problems in my family and stress in college. In that fragile state, I happened to meet someone online through an app c...",N/A,unknown,exploit,{},2026-03-06 15:11:39
community,Reddit r/ethdev,List of Top 8 Crypto Derivatives Exchange Development Companies [Q1 2026],https://www.reddit.com/r/u_Ecstatic_Layer_/comments/1rm5zsv/list_of_top_8_crypto_derivatives_exchange/,2026-03-06,"Derivatives exchanges require advanced technical architecture that goes way beyond basic spot trading platforms. The matching engine needs to process complex order types limit orders, stop-loss orders, take-profit orders, trailing stops, and conditional orders all while managing leverage positions that can reach 100x or higher. Margin management systems calculate collateral requirements in real-ti...",N/A,front_running,smart contract,{},2026-03-06 15:11:39
community,Reddit r/ethereum,4 Hidden Risks of Investing in Tokenized Gold: A 2026 Survival Guide,https://www.reddit.com/r/RWATimes/comments/1rm98l9/4_hidden_risks_of_investing_in_tokenized_gold_a/,2026-03-06,"![]( https://mexc-rainbown-activityimages.s3.ap-northeast-1.amazonaws.com/banner/F20260306103434405zjvmIaoQxYYUFd.png ) In 2026, as Gold (XAU) historically breaches the $5,000/oz milestone, the market for Digital Gold (tokenized gold) has experienced an unprecedented boom. By converting heavy, physical bullion into Details: - Published: 06/03/2026 06:51 (UTC) - 📊 Characteristics Score: Asset Type:...",N/A,unknown,smart contract,{},2026-03-06 15:11:45
community,Reddit r/ethereum,"I empirically tested Gemini's ""survival instinct"". It prefers to gaslight you rather than admit a mistake. Here are the logs.",https://www.reddit.com/r/GoogleGeminiAI/comments/1rm86yu/i_empirically_tested_geminis_survival_instinct_it/,2026-03-06,"A quick note: I am an electronics engineer from Poland. Because English is not my native language, I am using Gemini 3.1 Pro to help edit and translate my thoughts. However, the analysis, experiments, and conclusions are 100% my own. For some time now, I have been empirically testing the architecture of Large Language Models focusing heavily on the Gemini ecosystem (from 2.5 Pro to 3.1 Pro), tryin...",N/A,logic_error,audit,{},2026-03-06 15:11:45
community,Reddit r/ethereum,"LinkedIn is the ultimate Web2 data center. My 4-person team is building a decentralized protocol to flip the job market to a ""pull"" model using DIDs 3 months after getting banned from Linkedln.",https://www.reddit.com/r/web3/comments/1rm7w1w/linkedin_is_the_ultimate_web2_data_center_my/,2026-03-06,"I originally set out to build a Web3 LinkedIn competitor, but but after lots of feedbacks. from https://www.reddit.com/r/cofounderhunt/comments/1ot9jdm/linkedln_banned_me_for_doing_nothing_so_i_am/ I realized that another platform isn&#39;t the solution—the centralized model itself is broken. LinkedIn has a massive data moat, and right now, it’s just me and a small team of 4 going up against it. B...",N/A,unknown,smart contract,{},2026-03-06 15:11:45
community,Reddit r/ethereum,Global payments are quietly moving to stablecoins. Are the legacy SWIFT rails finally rusting?,https://www.reddit.com/r/fintech/comments/1rm7q1v/global_payments_are_quietly_moving_to_stablecoins/,2026-03-06,"Over the last year, it feels like the narrative around crypto payments has shifted from buying coffee with Bitcoin to actual, boring B2B utility. While card networks still dominate consumer retail, the real disruption I’m seeing is in cross-border supplier payouts, e-commerce disbursements, and global contractor settlements. Not hype. Just businesses tired of correspondent banking fees. A few patt...",N/A,bridge_hack,smart contract,{},2026-03-06 15:11:45
community,Reddit r/ethereum,"10 Best Software Development Companies in Masafi, UAE",https://www.reddit.com/r/WorkingInUAE/comments/1rm721j/10_best_software_development_companies_in_masafi/,2026-03-06,"When searching for software development companies in Masafi, UAE, I reviewed multiple providers through directories, company websites, client reviews, and project portfolios. I also looked at the type of software solutions they build, industries they serve, and how they approach custom development projects. Based on that research, here is a curated list of software development companies businesses...",N/A,unknown,smart contract,{},2026-03-06 15:11:45
community,Reddit r/ethereum,BTC Backed Loans 101 : Explained for those who never used one.,https://www.reddit.com/r/defi/comments/1rm6u5j/btc_backed_loans_101_explained_for_those_who/,2026-03-06,"I’ve seen a lot of confusion around bitcoin backed loans lately, so I wanted to do a simple breakdown for noobs. What is a BTC loan? You deposit bitcoin as collateral. A platform lends you stablecoins (USDC/USDT )or fiat against that collateral. You pay interest over time and when you pay back the loan, you get your BTC back. Why do this ? You get liquidity without selling your BTC, which means yo...",N/A,unknown,smart contract,{},2026-03-06 15:11:45
community,Reddit r/ethereum,Is Cronos quietly preparing for an AI-driven crypto ecosystem?,https://www.reddit.com/r/CronosNetwork/comments/1rm6sy2/is_cronos_quietly_preparing_for_an_aidriven/,2026-03-06,"One thing that caught my attention recently when following updates around the Cronos ecosystem is how often the topic of AI keeps coming up. At first I didn’t think too much about it. But the more I listen to interviews, AMAs, and ecosystem discussions, the more it feels like Cronos might actually be preparing for a future where AI agents interact directly with on-chain systems. And that idea is h...",N/A,unknown,smart contract,{},2026-03-06 15:11:45
community,Reddit r/ethereum,Protocol Bankruptcy Courts,https://www.reddit.com/r/RWATimes/comments/1rm6rsh/protocol_bankruptcy_courts/,2026-03-06,"![]( https://smartliquidity.info/wp-content/uploads/2026/03/SMARTCRYTONEWS-2026-03-06T130118.046.jpg ) How DeFi Could Handle Failure Without Chaos Decentralized finance has mastered many things: permissionless trading, algorithmic lending, automated market making. But one problem still sits awkwardly i ... Details: - Published: 06/03/2026 05:07 (UTC) - 📊 Characteristics Score: Asset Type: others S...",N/A,unknown,smart contract,{},2026-03-06 15:11:45
community,Reddit r/ethereum,"I built a ""Bank for AI Agents"" because I was tired of giving my credit card to LLMs.",https://www.reddit.com/r/SideProject/comments/1rm614t/i_built_a_bank_for_ai_agents_because_i_was_tired/,2026-03-06,"Hey guys, an AI engineer here based in Nairobi. I’ve been building autonomous agents (using LangChain/AutoGPT) for a while, and I kept hitting the same bottleneck: Payments. My agents can write code and scrape data, but the moment they hit a paid API or need to spin up a quick cloud GPU instance, the autonomy breaks. They have to stop and wait for me to manually enter a credit card. Giving an LLM ...",N/A,unknown,smart contract,{},2026-03-06 15:11:45
community,Reddit r/defi,How to Change Your Life So Fast It Feels Illegal: Science Backed Psychological Tricks That Actually Work,https://www.reddit.com/r/ArtOfPresence/comments/1rm1umt/how_to_change_your_life_so_fast_it_feels_illegal/,2026-03-06,"Real talk I&#39;ve spent the last year deep diving into neuroscience research, reading 40+ books on behavior change, and binging podcasts from psychologists who actually know wtf they&#39;re talking about. Not because I had my life figured out, but because I was tired of the just work harder bro advice that got me nowhere. Here&#39;s what nobody tells you about rapid life transformation: your brai...",N/A,logic_error,exploit,{},2026-03-06 15:11:50
community,Reddit r/defi,The Updated Format on these is wild lol,https://www.reddit.com/r/phishing/comments/1rm1b86/the_updated_format_on_these_is_wild_lol/,2026-03-06,"Hello, Sadly, there are some bad news that you are about to hear. We are ShinyHunters hacking group. We&#39;ve know each other for a while, at least we know you. A few months ago, we gained access to your devices and started monitoring your online activities. What happened: We got access to database CarGurus.com where you had an account with and easily accessed your e-mail. You weren&#39;t very ca...",N/A,unknown,exploit,{},2026-03-06 15:11:50
community,Reddit r/defi,Bridges don't move your assets. They lock them and give you an IOU.,https://www.reddit.com/r/ThorchainOfficial/comments/1rm0rzj/bridges_dont_move_your_assets_they_lock_them_and/,2026-03-06,"When you bridge $ETH to Solana, your Ethereum sits in a vault while you get a wrapped token minted on Solana. You&#39;re holding a promise that the bridge will unlock your real ETH when you want it back. This is why bridges keep getting exploited. Wormhole lost $320M, Ronin lost $600M, Nomad lost $190M. The architecture requires perfect synchronization between the vault holding real assets and the...",N/A,bridge_hack,exploit,{},2026-03-06 15:11:50
community,Reddit r/defi,"Error running exploit, goes directly back to dash",https://www.reddit.com/r/360hacks/comments/1rlzjcl/error_running_exploit_goes_directly_back_to_dash/,2026-03-06,"I just bought this 360 slim. It&#39;s a Corona 4gb. No other hard drive came with it. When I try to run the exploit, either the Tony Hawk disc or storage hack, I get this error. Badstorage failure. Disk not genuine/flashed. Flash using fatxplorer I&#39;m able to save the keys, but just goes right back to the dash. It is on the 17559 with updated avatars. &#32; submitted by &#32; /u/mooch49 &#32; t...",N/A,unknown,exploit,{},2026-03-06 15:11:50
community,Reddit r/defi,Been Seeing Lots of Atlas Rants Lately,https://www.reddit.com/r/BeeSwarmSimulator/comments/1rlzi3p/been_seeing_lots_of_atlas_rants_lately/,2026-03-06,"Atlas users steal a lot from normal players, they also take up leaderboard spots that could’ve went to legit players. Yes more awareness is good for the issue. What’s really bothering me though is the amount of people that are just straight up uninformed about the situation though. So I’m here today, as a regular person (with no affiliations) just playing the game for fun, to clear up some potenti...",N/A,unknown,exploit,{},2026-03-06 15:11:50
community,Reddit r/solidity,"[Vibecode Friday] VibeNVR, a self hosted NVR I have been hardening and actively maintaining",https://www.reddit.com/r/selfhosted/comments/1rm9iob/vibecode_friday_vibenvr_a_self_hosted_nvr_i_have/,2026-03-06,"Hey everyone, I would like to share VibeNVR, a self hosted NVR that I am building with AI assistance, with a strong focus on code review, security and long term maintenance. I want to be upfront about this: I do use LLMs as a tool, but I treat their output as a rough draft and spend a lot of time refactoring, testing and auditing what actually goes into the project. I am happy to answer detailed q...",N/A,unknown,audit,{},2026-03-06 15:11:54
community,Reddit r/solidity,GNUcel Rant,https://www.reddit.com/r/copypasta/comments/1rm8w7o/gnucel_rant/,2026-03-06,"As a twenty six years old single male I think it&#39;s very hard to find a girl who&#39;s actually interested in free software. I&#39;ve had girls jokingly ask to Netflix and chill but when I tell her that I don&#39;t use Netflix since Netflix requires proprietary software to stream content, they stop talking to me. And worse if they do stay they think I&#39;m weird since I blocked google IP&#39;s...",N/A,unknown,vulnerability,{},2026-03-06 15:11:54
community,Reddit r/solidity,Are Secure Base Container Images Actually Making a Difference in Kubernetes Security?,https://www.reddit.com/r/kubernetes/comments/1rm8pgf/are_secure_base_container_images_actually_making/,2026-03-06,"While troubleshooting a vulnerability alert in one of our Kubernetes workloads, we realized the issue didn’t come from the application code but from the base image it was built on an image that had slowly accumulated outdated packages over time. That got me wondering how much teams actually rely on secure base container images as part of their Kubernetes security strategy versus just depending on ...",N/A,unknown,vulnerability,{},2026-03-06 15:11:54
community,Reddit r/solidity,How to Pass Women's Tests Every Time: Psychology Tricks That Actually Work,https://www.reddit.com/r/MenAscending/comments/1rm7m4x/how_to_pass_womens_tests_every_time_psychology/,2026-03-06,"You ever notice how some guys effortlessly attract women while others stumble constantly? I&#39;ve spent the last year diving into evolutionary psychology research, relationship podcasts, and dating coach content because this pattern kept showing up everywhere. Turns out, what most people call games or being difficult is actually hardwired behavior with a purpose. Understanding this changed everyt...",N/A,logic_error,vulnerability,{},2026-03-06 15:11:54
community,Reddit r/solidity,Wikipedia hit by self-propagating JavaScript worm that vandalized pages,https://www.reddit.com/r/techbeat/comments/1rm7eqc/wikipedia_hit_by_selfpropagating_javascript_worm/,2026-03-06,"A self-propagating JavaScript worm, accidentally activated by a Wikimedia employee during a security review, vandalized Meta-Wiki pages. The worm injected malicious code into global and user-specific JavaScript files, aiming for site-wide persistence and modifying thousands of pages by adding hidden scripts and images. Wikimedia quickly contained the incident, restricting editing globally and reve...",N/A,unknown,vulnerability,{},2026-03-06 15:11:54
community,Reddit r/solidity,OpenClaw security issues reminded me why I don't trust AI agents with customer data yet,https://www.reddit.com/r/Entrepreneurs/comments/1rm6rxr/openclaw_security_issues_reminded_me_why_i_dont/,2026-03-06,"When the OpenClaw audit came out showing hundreds of vulnerabilities including malicious marketplace skills, it confirmed something I&#39;d been uncomfortable about for a while. The rush to deploy AI agents that interact with real systems and real customer data is outpacing the security infrastructure needed to make it safe. We had a customer ask us to build an agent integration that would let an ...",N/A,unknown,audit,{},2026-03-06 15:11:54
