category,source,title,url,date,summary,amount_usd,vuln_type,keyword_matched,extra,scraped_at
news,Google News,Cetus Protocol hacked for more than $200 million - Elliptic,https://news.google.com/rss/articles/CBMiggFBVV95cUxQVWNZdDNtUVFValhxSnVMa0kxZ0JFc3hnaGZ4cUE3RXpQbndFQU5VYVJIaUZ3LUhpVDRUN25lNklpcmk5RWdMaUMxU0ZnWDJZUUo0a0pOV2docGpsa2wxTlJlV0pyNVdwbnAwRnpnZEw5aDI2alhyd3dqOHhQZVd3ZHJB?oc=5,2025-05-22,Cetus Protocol hacked for more than $200 million Elliptic,N/A,unknown,protocol hack,{},2026-03-06 15:08:38
news,Google News,Preventing DeFi Hack Events with Chainalysis Hexagate Using Pattern Recognition and Machine Learning - Chainalysis,https://news.google.com/rss/articles/CBMiqwFBVV95cUxOa0oxR2lQcFNEU2xPXzVycUVVUVB2N1BYZ2l4RFp4Z0ZKRlcwUWZHa0RJa2dHN3doSXozakM1SEtVSFQ1M3RtRXVqbjAxUGNuMGZMRlVnem10M2hmdXk4cllWdmFWSE9Ja3J0ZWZWY2FYd0M1dFlWQk9wZmhETHJOOEhkSW9hd2dXMXY4Nkp2M0dSZ0FVb2dfQ1QxNjl5Z0FOS0wxNndEc2d2NFU?oc=5,2025-05-21,Preventing DeFi Hack Events with Chainalysis Hexagate Using Pattern Recognition and Machine Learning Chainalysis,N/A,unknown,defi hack,{},2026-03-06 15:08:38
news,Google News,ChainGPT Partners with Alibaba Cloud to Open-Source and Host Solidity LLM - Coinfomania,https://news.google.com/rss/articles/CBMinwFBVV95cUxNVkFCT1Juc1o1eXVGMC1BdmEySUtEUW1YLXJkMkZsUjNNazl0bVVXOVZaa2JlNXZJN2N1T2FYbER1X0hLdUNvcUpia3hJVkV0TGNjSWlvTGlKMXRHcWtRNEw3X3picEZMdE9zNDNHcjN4V2hOVzBSX184a3R6TUR0SnBYeW9KbkJXR2g0b1dCSG4yUWVSTFZhVHRmOHd5YUE?oc=5,2025-05-15,ChainGPT Partners with Alibaba Cloud to Open-Source and Host Solidity LLM Coinfomania,N/A,unknown,solidity,{},2026-03-06 15:08:53
news,Google News,Key Suspect in $190M Nomad Bridge Exploit Extradited to the United States | TRM Blog - TRM Labs,https://news.google.com/rss/articles/CBMisAFBVV95cUxNZUJwR3QzdzRnTVhMczJ2YU1LWXV1M2tONER3VXZJUG1JUkgtMTMtM3VmTHFKWkRhVm1MMHk2OURUSm9EM1ZweGNUSExzMHZLZ21lYW5qanBLVFljR1Q2LW80ZzF6cnNsNDVBdFhyd2JyWkd2eVJ2dFdPejhNQmZ1bWNqQXRhb3JtTFZ1a000Zi1kNXdfLWpacVlWLVJsOTVsb2FSNU9EY0dfT2l0TGtaMg?oc=5,2025-05-15,Key Suspect in $190M Nomad Bridge Exploit Extradited to the United States | TRM Blog TRM Labs,N/A,bridge_hack,exploit,{},2026-03-06 15:08:56
news,Google News,Crypto price manipulation explained: How cybercriminals influence the market - TradingView,https://news.google.com/rss/articles/CBMi1gFBVV95cUxObUNTeXphcVZJMUxpNE45RV9rOFQ4QzFoN1BtWng1TjdMWGVqTUF3T2c1UVlSRmlMRWVlZVFjb09iLW52TENJRHB2VVUxZ0Q4S3BsUkRGcUp4d3RZMEtLaWNycDlzeDE0ejNpMmpnZzNBdlhWZGZwVFlyN2hQTHJTaVkxUXVRSVFSNXZvbXZmVzdaNmxXZDNPSnNfZkdwQ1QwbURTTm9Ja0R5Vm9hR3dseHdMVk5RQm5fNDdfQlJVbmxZUVpOOFd5VE9sejNQRjRPblVUbzNn?oc=5,2025-04-27,Crypto price manipulation explained: How cybercriminals influence the market TradingView,N/A,oracle_manipulation,price manipulation,{},2026-03-06 15:09:00
news,Google News,DEX KiloEx Loses $7M in Apparent Oracle Manipulation Attack - CoinDesk,https://news.google.com/rss/articles/CBMiqAFBVV95cUxNVzF3UTBqQ0wtM1JUcndnUzJUbWMwSm1FNTRCbm95OV9CaFROM0hUcjhHTnZEaGVGM0tGVnBMdnhIb08tM3EyYldrLVdCTkloN1ZSSXZFUWt0RlFOcHo1OHd2bHRfMDEyb242RDcwSkdlMERwUGoyNWRMQVg1MFdZVnFLN2UtRW04VHdoS1l6ZzRySHNfbnAxcklPZ2tsalBucmVBR1N5WHY?oc=5,2025-04-15,DEX KiloEx Loses $7M in Apparent Oracle Manipulation Attack CoinDesk,N/A,oracle_manipulation,oracle manipulation,{},2026-03-06 15:09:00
news,Google News,Experts Unveil Details of Oracle Manipulation Attack on Venus Protocol - ForkLog,https://news.google.com/rss/articles/CBMimgFBVV95cUxNbEdqZ3hFMG1lTGkyQXBka1laNEo2V1YtRVBoWlVOcVZ4TkhSZFBKVEpkczVaMDNmVVZWMmpwQWRCZWlDVnZkSEhVNnlfMHMzTWluVGhmd0xSUVl5MW0zVGZSNEM1QXJncnBiUWZsM2NjZmtncXladEYtMmNubHc3allhTkVKSHpWZUZGajhSSVc0Y1h4Ry0xN29n0gGfAUFVX3lxTE5pdGc0eEJjajVBb3l1MVV1am5hdFlBV0prSEJHNGNQMHFEelkycHdUc3dUdVpYZm03WEM5MkNvaTZoRU43cl84dXFvbEVfRDQ2NlpCLU10THlFZTFfc21hWHY1a19OR21sZFpyUHRQa0ppaE1rR3h4NGRRS0NJZGNQbnFuaWpzTDJILWtiYUFVTlBwZW1NYmdLZVFwY1Q0dw?oc=5,2025-03-31,Experts Unveil Details of Oracle Manipulation Attack on Venus Protocol ForkLog,N/A,oracle_manipulation,oracle manipulation,{},2026-03-06 15:09:00
news,Google News,Analysis of $700k oracle manipulation exploit highlights vulnerabilities in DeFi vaults - The Block,https://news.google.com/rss/articles/CBMivwFBVV95cUxOYnluekduQ3dLYlRYV2hqZUZYS2c2MlF2cEFUTlRmVUpJWjhUVjRUcW9UeXRxUURtYWM2NDJBdHdxRU94ZjRULTdlZUxaYTBvUEc1WTJ4bVFOaTZKNVJvak9LWVo4TWVrUkJfWi0xOXlNWUN6Rmh6RzE1Q25ycVQ3ai1sUlR0R2VaTjdIQjlTMndVTHFEUF9aMDVOMzdzby1XWUJUYTdVZ0FVS1RjOGJkWl95YTJldTFfa3VHSndBZw?oc=5,2025-03-30,Analysis of $700k oracle manipulation exploit highlights vulnerabilities in DeFi vaults The Block,N/A,oracle_manipulation,exploit,{},2026-03-06 15:09:00
news,Google News,"Hacker Exploits Smart Contracts Vulnerability, Steals $13 Million in Ethereum - CryptoDnes.bg",https://news.google.com/rss/articles/CBMiowFBVV95cUxPcnFxbEk3eXJWM05GRC14aDBCemY5UWh6M01GZEd4TWJjYS1vOU10dXJYMk1iVjJmeEZHZmUxZ2VwbWNsRmtod3F1S21Tcm5FVGowS21YSnBRNHN2WkVjLXpZcEd6TmxRRzhBMERuN2NwZTdKU3FqZ0lRYVE1YlN0QXA5aG9CdkVCcHRaR1FOeExWWm90eFRZdGROdmlRWk5HMGxV?oc=5,2025-03-25,"Hacker Exploits Smart Contracts Vulnerability, Steals $13 Million in Ethereum CryptoDnes.bg",N/A,unknown,smart contract,{},2026-03-06 15:08:41
news,Google News,Hacker steals $13 million in Abracadabra's 'Magic Internet Money' seemingly using a flash loan attack - The Block,https://news.google.com/rss/articles/CBMizgFBVV95cUxOSlNNUHN2dzdENnFVWmh5RzFpX1JPUFcyQmtOUVJEYk5qal8zdkRBdW1rQ0F2OWhsZTBRWU03SDltcHJ0WllMYTN3ZHA3b3hwZHN3ODFGQzBZRVk5R1RCQktRYS0xX18wUnF5SzJWZHNxd0xnaFhkdi1qU3p1SmJIRm9iM20tbHI0amRCb2hXdlVPSkZJTXI5V191NEw0bDBQVktDNldSbzh2ZGJQVFc1WXZHU0xwWWJlanRHVC13NVVuWmZpRFFwNEtGRjVoUQ?oc=5,2025-03-25,Hacker steals $13 million in Abracadabra's 'Magic Internet Money' seemingly using a flash loan attack The Block,N/A,flash_loan,flash loan,{},2026-03-06 15:08:50
news,Google News,Liquidity Drained from Meme Coins! Hackers Exploit PancakeSwap Vulnerability to Steal Liquidity Funds from Emerging Meme Coin Four.meme - Binance,https://news.google.com/rss/articles/CBMiY0FVX3lxTE5TTEVwZnJyYkZJekN6djBRTVBwMHFTOFBQd1I2MDJRMG51b2EwMXhkenR2RDdDVGh6Y1JrZWpkSFY3bGVfS1d5eVpzaFFQdjNMS19MeF9LU1RuV1R5a0d4SWwtaw?oc=5,2025-03-17,Liquidity Drained from Meme Coins! Hackers Exploit PancakeSwap Vulnerability to Steal Liquidity Funds from Emerging Meme Coin Four.meme Binance,N/A,unknown,exploit,{},2026-03-06 15:08:41
news,Google News,Shocking Web3 Security Breach: WebKeyDao Loses $73K as Hackers Exploit Smart Contract Flaw - Coinfomania,https://news.google.com/rss/articles/CBMiswFBVV95cUxPdTVoNm1VNy1kT3FuY1JDWmpjdEpRU2JZcGFPWTZKazM2T1NEUE5RdlVlc2RjODMzMmQyRUp2ZmNpTFY0U2wyNEVyeUw3SGNtaWxwTE1pS0VubEgtMHd5Q1JuNklBbU53RmdPc2c4N0tXN2QxMUhNMTk2TTJnMmpscm1uZzFHMFNrY2JLV2diV3BjQlNORnF5TjUxcWNkMXNHM0pfUl9uUWcxa0ZFTnM0cWNuYw?oc=5,2025-03-15,Shocking Web3 Security Breach: WebKeyDao Loses $73K as Hackers Exploit Smart Contract Flaw Coinfomania,N/A,unknown,smart contract,{},2026-03-06 15:08:41
news,Google News,Why Smart Contract Audits Can’t Prevent Off-Chain Attacks: Lessons from Bybit Hack - CCN.com,https://news.google.com/rss/articles/CBMiqAFBVV95cUxNWkZPTFFuQVAwQ1VMcXd6V1BMbzNETDRaWW9pU1diRGxnWERIR1JNWjdLUm1Ya2VUWDRlYkxXX2Q5M09RdUhaeEdlMWo2Sk4tb3U3SVJzYWRJNXVxMHdhWnpTeWs4cnF5Si0tSWk4Vi1IVHA2WXRNYVl3TXZ4RVFWd0ozLW5FU0dKZFh2SV93R1FVbFY3UW1YcDNvcVR0NjFxeEVCV2xob3A?oc=5,2025-03-10,Why Smart Contract Audits Can’t Prevent Off-Chain Attacks: Lessons from Bybit Hack CCN.com,N/A,unknown,smart contract,{},2026-03-06 15:08:38
news,Google News,$140k Security Breach on Arbitrum Network: Attackers Exploit Signature Verification Vulnerability - Coinfomania,https://news.google.com/rss/articles/CBMivAFBVV95cUxNSG45b2M5dWJ3STVNMlpKM0ZZdU9JVEhCWms2ZzRfODhPX21ORFMxZlJka05Tb1NUbFRiS2JCRjJSenlLazY2RlJ2Sm8xR0ZidGhfcU95SWt0emZpNzBrVHFTR2RZektLWmpORi11a2ZCYmRqUTNEeDJJWWlmVzROcGZ3SksyYURnMVNvTUdkUl9VbHQxRnVpbjV2OVgyZHh5cXQyZTRFUXY1ODlub1phTF83eldPQUxMaFUyNw?oc=5,2025-03-10,$140k Security Breach on Arbitrum Network: Attackers Exploit Signature Verification Vulnerability Coinfomania,N/A,unknown,exploit,{},2026-03-06 15:08:41
news,Google News,1inch resolver suffers $5M hack due to smart contract vulnerability - TradingView,https://news.google.com/rss/articles/CBMiygFBVV95cUxNbjllbTdoaTMyeUJ6Y3JfS09JZU9pUFNhQ3YtVXRaT0hZblVFaUdmVy1RcEIwQjBCblFtdW53Wm0tMkhQUk45Zlk0RU1hZTdHdGZqR0xzRDNyVmRyUkZvTFFaaF9ELWs5Y1VWenVVWGRlQjhHRmRDVjhiakI3VzM0Wl9YRm1WTzcxUUU1eFYyV2oxOVBFYzdyNEVXVzlsTE14SU80SklJMEVWTnlKWGh6UE13MC10MVQwQ2RjMmpDb0RrT0g5UFVXeVJB?oc=5,2025-03-07,1inch resolver suffers $5M hack due to smart contract vulnerability TradingView,N/A,unknown,smart contract,{},2026-03-06 15:08:38
news,Google News,‘Biggest crypto hack in history’: Bybit exploit is latest security blow to industry - TradingView,https://news.google.com/rss/articles/CBMi3AFBVV95cUxNdVh2ckF6dnU5a2R1MGFfc0lRdTd5NUlUUXdsUnd2M1JpR1VOaTFLQkx1SGswNk5rRE1ja1lBaUtGbzlUNGJUNGJlMDZIcGg0ZGFjcGRKbFpweERRTktvaURCOW54VlF1QllQOWtRYTVNWnAtZmdXa0ZWc3J1SFg5TVdDN1V4QW9OV0dQNmtjazNvc25CMFJHR19id3N4VlBicnNMeFRZSGF0bHIwX25KYUN1R2FpdFhOaGIzUUdnc3ZWWTZ4Sm5ITGk2TG5ONUZxcGFaQ3NmbEcwU05S?oc=5,2025-02-21,‘Biggest crypto hack in history’: Bybit exploit is latest security blow to industry TradingView,N/A,unknown,exploit,{},2026-03-06 15:08:56
news,Google News,22-year-old math wiz indicted for alleged DeFI hack that stole $65M - Ars Technica,https://news.google.com/rss/articles/CBMiuAFBVV95cUxQVzJ6VDZFRVF2czJqSjdIMlM3SHRWVHltN1d5Ynpzc1BTV21kS1RBSklOWFJjUFNzRFJEMWk1RURnNFhfSl9pX0M5bW5PSXAzS1V1R3NsRXpjSF9EU3FfWkR0cUZSNktlUjJBb0VJdmxUMFBHY3dUYUhEdWN2VjZ6bUlQUnBaQmNQeHBkWlljX2lHX2VBVndhUDAtRF9YUS1Vai1uVHFEc0hKdUprOTNXNE9UcGpWTEh6?oc=5,2025-02-04,22-year-old math wiz indicted for alleged DeFI hack that stole $65M Ars Technica,N/A,unknown,defi hack,{},2026-03-06 15:08:38
news,Google News,Securing the Future of Blockchain: OWASP Smart Contract Top 10 (2025) - Binance,https://news.google.com/rss/articles/CBMiY0FVX3lxTE5oV0NZRTZMN1Y1TzktcFE2LVB6aUtXTVRIVmZRcWdUN3VOY3I0Q1ljQ0t1Y2swanR5UEpYS2twMXFTTUJrbS1kX0pmNG5hM25qdXNCY0liRkxoZDlGN01oVHBVSQ?oc=5,2025-01-26,Securing the Future of Blockchain: OWASP Smart Contract Top 10 (2025) Binance,N/A,unknown,smart contract,{},2026-03-06 15:08:41
news,Google News,OWASP Smart Contract Top 10 2025 Released – What’s new! - gbhackers.com,https://news.google.com/rss/articles/CBMiZkFVX3lxTE5ucFBKN3VSa2o1ZmNJMEw5NklPZTZGWDJLSTBXbUVROGxiWmhSN2NOclFKd0VscUFzRkRQTjNNUG5WRXRXRE55ZTJtRmFBLU9VWE9jOXFtS3dmTnlWaEhpNlZtMjNoUdIBa0FVX3lxTFBhWDNWcEpPeG9fcG1RMGVsbWNmMHpIckhMRlFKNkRuRmgxZnczSldFaGdfc1lEbmtYOG1sTEo2WVowT016czRyQVJSOHlzcWFJNEduZk8xam1zcW1NQ281bG95cnNBa1otYVpn?oc=5,2025-01-21,OWASP Smart Contract Top 10 2025 Released – What’s new! gbhackers.com,N/A,unknown,smart contract,{},2026-03-06 15:08:41
news,Google News,OWASP Top 10 2025 - Most Critical Weaknesses Exploited/Discovered - CybersecurityNews,https://news.google.com/rss/articles/CBMicEFVX3lxTE5XTjh3MUcwZDhIaGljTlp5Y1RnMzNDcjEyNms4dHhXNTZkWFA4SWlqdEVDMmtLc3F0Z2tPUHU5X1daRkJvM2JHUjRVSmUtdDl1YkZMbnB0OGM5S2ZvbTlUWGtNa0tWUGl2MHJCY3pSRV_SAXZBVV95cUxQZFJ5NEFxcmRDcl9NVE9DQW52NHJVaU1GRXBFN1djOVk2VkhDUVlTUTZxWE9faUJPS3h0ZVpfNkNUcjVLWGd1LVc2QzIzamZEZXZtMlhVSER2Q2RheGk0U3pIZ19ycklpYVFsQkMwTHVsQ1N2VzZn?oc=5,2025-01-21,OWASP Top 10 2025 - Most Critical Weaknesses Exploited/Discovered CybersecurityNews,N/A,unknown,exploit,{},2026-03-06 15:08:41
news,Google News,Smart Contract Security Risks and Audits Statistics 2026: Risk Surge Now - CoinLaw,https://news.google.com/rss/articles/CBMie0FVX3lxTFBmRGJ4UjJTaFJRcTFjbHJaOTlGQ05GSzh2VWhDeXNRZGhaZ2FoVFRneExLQm1OSDJSVEpjeFlyWk1ybkpwOV9mSTlrSXBLRUpCYU5iMUcxWEdYbmtHSkpCOEppUjRqVGg2NEFoT3loUFVMb1AtYktqVF9wcw?oc=5,2025-01-06,Smart Contract Security Risks and Audits Statistics 2026: Risk Surge Now CoinLaw,N/A,unknown,smart contract,{},2026-03-06 15:08:41
news,Google News,The 10 worst crypto hacks and exploits of 2024 - The Block,https://news.google.com/rss/articles/CBMib0FVX3lxTFBYd19TOFdMcjhmYWlqdlpLMFZ6VGVQZkllaHB1TmdNNWJiOW1Kd3BSSWdGZEJ1U1lmeEgxWEFfRWZ0TlVELXdtRmNQZzBtSWRCOUpNR0JUZkVLX3pYdWNBNXZGNjFQNkZvQjBFUV9BOA?oc=5,2025-01-01,The 10 worst crypto hacks and exploits of 2024 The Block,N/A,unknown,exploit,{},2026-03-06 15:08:38
news,Google News,DeFi hacks of 2024 - CoinGeek,https://news.google.com/rss/articles/CBMiUkFVX3lxTE1ld2VWMnBfRS1ZZzFDZVlQOEs2aU5Xc01MeGFNcGxmYUpxX29CUDhFQ1kxYTVqd0RIMnBCVEo1blpwUTZMZk5TSGtlcVdKOVJ6Unc?oc=5,2024-12-30,DeFi hacks of 2024 CoinGeek,N/A,unknown,defi hack,{},2026-03-06 15:08:45
news,Google News,The Gem Pad token launchpad has been exploited for $2M on multiple chains - CryptoRank,https://news.google.com/rss/articles/CBMif0FVX3lxTE9lSC1ZaHNXWm5IQ0R0NzltWUpPalRjN19ES1VlSzdCMmhrZllpNzEzSmFYTFNEbVZtTU82SjVVdFR3c1BybVpvZnNkbnpVOHphQ1AyazlQbGhDSHcwcndncGJHWHMtSkVETUkzVVBZc0RDVUphSkFubWhCVENPRDQ?oc=5,2024-12-17,The Gem Pad token launchpad has been exploited for $2M on multiple chains CryptoRank,N/A,unknown,exploit,{},2026-03-06 15:08:47
news,Google News,"Hackers Drain $1.48 Billion from Crypto in 2024, Led by DeFi Exploits - Hackread",https://news.google.com/rss/articles/CBMif0FVX3lxTE1GbG1GbFFkbjVhMlVyNkNpRlk3QW4zZWlLeURBM2lIaV9BcTFKRFdqZE91OXg5T2d3c19VdnF0NHVRUWlJbG1WTGhaT0JuaWxYUk8zam1IUkNoLUJIZmd5OEt5a3RjdUZZSktWYXRMREpET2ZYSG1YRHN2OVFldTg?oc=5,2024-12-02,"Hackers Drain $1.48 Billion from Crypto in 2024, Led by DeFi Exploits Hackread",N/A,unknown,exploit,{},2026-03-06 15:08:45
news,Google News,Flash loan attack and 24 years in prison: What's happening in Crypto-Sec? - Binance,https://news.google.com/rss/articles/CBMiY0FVX3lxTFBkaVBGSlhfOTRwbWdvSkhpSzV4VUxVbWE2UEgwUmIzNEwxVzlLaDlpV2RKQjRXOGl3ZGt5RTEtY1pmV09VWTJ3U2FNMDg1RGlZWXFjMXdhWDF3Wms0dF9PU2Z6MA?oc=5,2024-11-18,Flash loan attack and 24 years in prison: What's happening in Crypto-Sec? Binance,N/A,flash_loan,flash loan,{},2026-03-06 15:08:50
news,Google News,Euler returns to launch v2 modular DeFi lending protocol following 31 audits post-$197 million hack - The Block,https://news.google.com/rss/articles/CBMinwFBVV95cUxNVWo1ay1FTzdqWU9NUk1razd2blZ4R1Zva0hsaTZKUmw0UC12RzNMejhBcTBIbFVnMDR4SU5rNFViWWpKZEFDSHUyb21LZ2J2MTNqVU5najdYbjZvRERZcl9xX1pkbUhsWURHVkRCREpwYUMybENrTHpKcjVEdlhieUd6X1pYRXZYVTNWYTNjS3FOU2FKTDIwSWFlZnlaVE0?oc=5,2024-09-04,Euler returns to launch v2 modular DeFi lending protocol following 31 audits post-$197 million hack The Block,N/A,unknown,audit,{},2026-03-06 15:08:50
news,Google News,Wallet Linked to Nomad Bridge Hack Transfers $36M of Ether to Tornado Cash - CoinDesk,https://news.google.com/rss/articles/CBMiugFBVV95cUxQSThnN3hVRXdVTHQySlc4bXdTOFN6NC1oUzU0alcxcmU4TXFOSGFLVTZVYTllLWpOSGxHb1pFQ2Rla19xV2dHVEMycHBaMVpVSWd0aU0xdGlWa2xiRDhPUTFsa3VPQUJlN1dQWDdvMkpQd2d4UTdPWGQ3Y3B5MVlEaS1MelhVZFpvTFNRaldfVldXc3FWcjFUUTFOZTh2S1RxZ09yZTJzd1BqYnlHaG8tR19WTFNLU0RFakE?oc=5,2024-08-08,Wallet Linked to Nomad Bridge Hack Transfers $36M of Ether to Tornado Cash CoinDesk,N/A,bridge_hack,bridge hack,{},2026-03-06 15:08:56
news,Google News,Terra Blockchain Restarts After $4M Exploit - CoinDesk,https://news.google.com/rss/articles/CBMiiwFBVV95cUxNX296NnJEMzRtZlB1alVsNFBSdnBQMTZyYk9Jb3FYT2RfVlIwSG1hMkRVcEEzUDhpMEdUNkJvSWtTWG1DS1MzQjVFa29fNFc0Sk9kNDF4T3lhZ1NGUzd4VDRybUViRkxSTk1GQ28wX09RM3B2ZGFCTXNwYmFvQXktb3l2T3FyZUxxVllv?oc=5,2024-07-31,Terra Blockchain Restarts After $4M Exploit CoinDesk,N/A,unknown,exploit,{},2026-03-06 15:08:47
news,Google News,Defi Protocol LI.FI Struck by $11M Exploit - CoinDesk,https://news.google.com/rss/articles/CBMijAFBVV95cUxPMGVKU0VFaGZxYURvQmQ2X1VBZDFuSzI4dDVUY1E2OUp0ZEhocFp5bkxDN2dOMk1aNHFGeHZxX2ZMakV6a1MtWVdBZ0Fmc3k3anEtZ3lrYkoxRnFqUWsxZEhTS0pZZU4ybnRwMXNJbzJleWNGNXdvNWs5aVVxdDA0SFNnQVJKLWNnc1A2WQ?oc=5,2024-07-16,Defi Protocol LI.FI Struck by $11M Exploit CoinDesk,N/A,unknown,exploit,{},2026-03-06 15:08:38
news,Google News,Funds Returned to DeFi Exchange Nirvana in First Ever DeFi Hack Prosecution | TRM Blog - TRM Labs,https://news.google.com/rss/articles/CBMitAFBVV95cUxQT0k2ZUt6TG5wbDNFRHNCQzRKSElmUmJDVUNrUHhjMExEbGFSa2ZxME1iV1l3Vy1Yei1xbExFSnNILThvYmVibVJIanpVcUVCSmlLeDN4QVJIcnlPejdlcE1LWDY4V19BU1RzT1J5dnNFS3lTdk4zQS1VaENpem5WbjNNc1E1TGdZb1F3LVpLVjhUVERjb0l6QTNDRDBQeWo4RUdVTF9wUUlCTUhINktvMTVQWjc?oc=5,2024-06-04,Funds Returned to DeFi Exchange Nirvana in First Ever DeFi Hack Prosecution | TRM Blog TRM Labs,N/A,unknown,defi hack,{},2026-03-06 15:08:38
news,Google News,"Popular Base Memecoin Normie Exploited, Reportedly Strikes 'No Reprisals' Deal With Hacker - International Business Times",https://news.google.com/rss/articles/CBMitAFBVV95cUxPSmpuN1dvcFhkVmJiaTNtNEF1SVdlejFwdGtIb2FhOE1lWTRFWDUySU5IVVdiS3UzT00xMy1wU2RrYnR0bjhUWUdrLUJPelktb0dYOGoxSWZhTTlYSTZNVXJ1c1Rzc2M3dWVUdnQ5UDc4SHlBQkJSazdlblVTdUhZQ3JvNzltNVdVc2RsbWFTQXY2TVkwUGhLMDVWMWNUaElPTEUzUEpHMGdseTdGc2RUa1hsLWQ?oc=5,2024-05-27,"Popular Base Memecoin Normie Exploited, Reportedly Strikes 'No Reprisals' Deal With Hacker International Business Times",N/A,unknown,exploit,{},2026-03-06 15:08:51
news,Google News,"Crypto-Related Exploits, Hacks, Scams Reach Over $79M In March : CertiK - International Business Times",https://news.google.com/rss/articles/CBMimwFBVV95cUxPYXUzMXc1LTBnYUhoRncxWjJ5UUVXR2MySW0wblZfVnV3RlU5SXNLdzd2djhqWFJEaGdyeUtxNDNEUFJzMU95WlZ3d2tKTEQwYkgwUVN0OXFDS3JDUEw2SWhKOUExVlVDRE9fMzFTNEV4M1VEYmhwNG44cVRHelM1MmEtNTNKSHh5QUdhMXJzZWF0aGpab0lUV3lFbw?oc=5,2024-04-01,"Crypto-Related Exploits, Hacks, Scams Reach Over $79M In March : CertiK International Business Times",N/A,unknown,exploit,{},2026-03-06 15:08:51
news,Google News,ParaSwap evades hack targeting Augustus v6 contract vulnerability - TradingView,https://news.google.com/rss/articles/CBMiyAFBVV95cUxOUmtXSURERE5IM1A4T2kxWERCN01Ed0daaldJdVhTR0JtcjdVV09SVFoxVy1fY3Fxb25yVEdDc3NWT3owS1ppQmNmd1JxSG9COFpwcExnWFJOTnBDSXhhYkgxa0RXNzlHa01zeTVKRk1pUG8wc016bHA4a2FHRzFSa3V3V0FSMlRYT0N4Y0FGTVZ5a09qNnltZmxkZ1U2cTE3aldoLUp2ZlJnS0FKcU9nQ2VfVGdKWmR4NmlDUVpzWTMycWJMeVktcg?oc=5,2024-03-20,ParaSwap evades hack targeting Augustus v6 contract vulnerability TradingView,N/A,unknown,vulnerability,{},2026-03-06 15:08:41
news,Google News,Wise Lending drained of $440K worth of crypto in apparent flash loan exploit - TradingView,https://news.google.com/rss/articles/CBMi1gFBVV95cUxPNGlkYnk1X2xVZVoyekNJVUlFYUtrb1lmMEFJRHhPcF8zUVA5NUpVNldwNVFGbi1OcEhNTE5iVmt6enoyS3RBRDM0OVRNVHlmWnY1ZVVwRWNFeXVQd1VkZ3M1UHdXY3REZ0d6amsyZ29ObG9JOE9tOTBqekx0ODRzekpJdXdYRTV4SjVhYXlydE92S2hLRHBvdjVPdEdvcUQxSkl3ZVg1VldBTC16blU0aEhmM0ZjVGlwNDdLUE1tZW15V2lEdi1CSkx5OUE5eFRpelBfZUZ3?oc=5,2024-01-12,Wise Lending drained of $440K worth of crypto in apparent flash loan exploit TradingView,N/A,flash_loan,flash loan,{},2026-03-06 15:08:50
news,Google News,Crypto Hacks 2023: Full List Of Scams And Exploits As Millions Go Missing - CCN.com,https://news.google.com/rss/articles/CBMipgFBVV95cUxQZmJBMTRaVnVRSTQ1dlF2WkdWb2ZLTTQ5U0JKOXdndkM3YjdHNjlvMldRcmhwaHplMVBNdDY2ZWpqazVaYXZaLVVoeDFVSWtoVjduMGJaNmZ5MTVNRlJPeVM3cEJJTUtXd2lURUhadF9wX2k0a2g4Q2Q0WDl1NUhhc2NUSVBDV3VzUkExc1hsWXl5WmlrTUxiTnBIQ0hSbWxYUTlkU3F3?oc=5,2024-01-03,Crypto Hacks 2023: Full List Of Scams And Exploits As Millions Go Missing CCN.com,N/A,unknown,exploit,{},2026-03-06 15:08:41
news,Google News,Orbit Chain Loses $81M in Cross-Chain Bridge Exploit - CoinDesk,https://news.google.com/rss/articles/CBMinAFBVV95cUxNLTlUMEFRZ3ZndlltTFpHWUY3TVJRLTE4TDRJd0RfT2xwZ2JSVGJrVnZrWkpNMTU2alIyS2pDcEM5VV9lRTV4NzhwZU81YWZiVk5nRFFWeHJXQzBwQkNjZVM0S2pzVHNKcnNnbDBIUDZCYlRsdTJzQzBidGRWcVI4UzFUbEZfbS1TQjlZXzNvVWc1QVNJd0tuczd3Y1A?oc=5,2024-01-02,Orbit Chain Loses $81M in Cross-Chain Bridge Exploit CoinDesk,N/A,bridge_hack,exploit,{},2026-03-06 15:08:56
news,Google News,The 10 largest crypto hacks and exploits of 2023 - The Block,https://news.google.com/rss/articles/CBMijAFBVV95cUxPeTJ4U0xlMXRBLWhNN085Y2xIa0ZPNWxSRjNrbUFxS3ZBN3dnZDNqM0VCc2w2b1haVzh4a05yNmZjMEtyOE9mNW9xcGhRa1RmR2FUU0lyWTJSLWJRemJIVDhEdjI2anJwSFFkVVdmOEQtX2FpM1hRbDFxNnNnYThHckZlX1p3V2QxZGRlbA?oc=5,2024-01-01,The 10 largest crypto hacks and exploits of 2023 The Block,N/A,unknown,exploit,{},2026-03-06 15:08:56
news,Google News,": Unveiling the 2023 Crypto Heists: Hackers Rake in $2 Billion Through Hacks, Blockchain Exploits, and Rugpulls. - DailyCoin",https://news.google.com/rss/articles/CBMihAFBVV95cUxQcFdEaE9WRUExa2hTcnBKNExZcVBCN1JzYmxHYjRmaHdwd09QSHlKWkl0NExaeFNodFBOam0xd2hmWVJtYnMzSy1ubG01MWJFdEFQSjA5bGZXb1NJNmw2TmxQeVlLVlE0UFhiam9QZzFwbkJvWEZVY3lFTm5TR0NEbjY2R1A?oc=5,2023-12-27,": Unveiling the 2023 Crypto Heists: Hackers Rake in $2 Billion Through Hacks, Blockchain Exploits, and Rugpulls. DailyCoin",N/A,rug_pull,exploit,{},2026-03-06 15:08:51
news,Google News,The 5 biggest DeFi hacks of 2023 - Blockworks,https://news.google.com/rss/articles/CBMiX0FVX3lxTE9FYlZiUTM3aFhqeGl0VENwY2VpVHdLLU42R0FwOE9rdGFZeHJfRW96Uk1DaV9HbUVOT1FSTklzcHp6cndmV0NPU1dlMm0wcXU5blFNQTNWNEZLZmVBNnZv?oc=5,2023-12-22,The 5 biggest DeFi hacks of 2023 Blockworks,N/A,unknown,defi hack,{},2026-03-06 15:08:45
news,Google News,"Ledger Exploit Drained $484K, Upended DeFi; Former Staffer Linked to Malicious Code - CoinDesk",https://news.google.com/rss/articles/CBMiwwFBVV95cUxOVWFiaWxNTXZ3dXA5bVlXT1FiZUNNZ19ST2h5bnVRTkJTaWtfMF9xRURiUm9WZXRWTFJqVVFYVVhQb1RfdjAtbDBMTU1xdXpGMHhDdTZQaG9XcWljWEFJYi03V0t1WlJpWDQtcWJ3S2Y0RzhmQ2tELUNGaVhlaklmdWc4SUhlNGM5LVhGQWtHVFhVb1ZqWG5jMm1RS2lSRXVzVnB3ZHdSRGN6TnlNYWtEQWpKR0tncGxiOURDYWlzekhDQTg?oc=5,2023-12-14,"Ledger Exploit Drained $484K, Upended DeFi; Former Staffer Linked to Malicious Code CoinDesk",N/A,unknown,exploit,{},2026-03-06 15:08:45
news,Google News,CoinEx Research: An introduction to common vulnerabilities and attacks in smart contracts - AMBCrypto,https://news.google.com/rss/articles/CBMisAFBVV95cUxNUFFyUmRRSmoybjNOVjNacTNoRFRSMkxOWmVtc1RNR21IRVMwRldnanRXX1dHVUlPSzFaZThZWV8tR3MtNlp1SjRRSHpQZExXck15ZjRzNVExbXh3T0s5dFJfaEpNamJyZEdLT1R1TGtqU04wTXNaTmU2SV9FWF9WNnk2MVc2N3JhYUhibmpaT1l4ZTFmTFp6S0JQUEs2OE9keWF0QWZYaTQya3JjNF96OdIBtgFBVV95cUxQS1JYQ05JWU4yRV9ZRmp2TTg4UEhCZmR4dGlHX2tGRnRkWFBjOEpKVXBlLXdqOWk0UDl2cXVaOEZUS3c2UmJfN3ZDM1VwWU9WbHA2VTZXajhtYnBkTlI3amJnTEdHUHZxdW4xeWJ5Z3MtS09LVVRMODlJY2FiODVVNjBqNnFmMEd4Z3o5REZVQUE5ZTRXWXhSeVA4VFpxMUZnNUM2N3c0dVJZaUpmODZZdlNqSkxFZw?oc=5,2023-12-06,CoinEx Research: An introduction to common vulnerabilities and attacks in smart contracts AMBCrypto,N/A,unknown,smart contract,{},2026-03-06 15:08:47
news,Google News,Deep learning-based solution for smart contract vulnerabilities detection - Scientific Reports - Nature,https://news.google.com/rss/articles/CBMiX0FVX3lxTFBhUEFxeEtJUEFDOUZrRmJrWG1iMVRLY194MUFCSkRaVFUwVlRQQ3J5OVFyZXE5Tm9hTTdXSjVwZjlGcVowYU42ZFV3cHFZemtsNnQ4djZGTEhXaXVRanRN?oc=5,2023-11-16,Deep learning-based solution for smart contract vulnerabilities detection - Scientific Reports Nature,N/A,unknown,smart contract,{},2026-03-06 15:08:53
news,Google News,"Who is the king of blockchain development languages: Move, Solidity, Rust - Binance",https://news.google.com/rss/articles/CBMiWkFVX3lxTE5IWXdMTlhhOVo3MEpRTW1TN1A1b083dFAwTm9vZWQwQ2x0MURldGtJc2IyY0Q1b1JqZ2tvSGpLOTRRc0h0bkxCVWJlN3Q5d3F2RXJsX1RjVXhLQQ?oc=5,2023-10-18,"Who is the king of blockchain development languages: Move, Solidity, Rust Binance",N/A,unknown,solidity,{},2026-03-06 15:08:47
news,Google News,DeFi protocol Platypus suffers second flash loan attack in 9 months - Blockworks,https://news.google.com/rss/articles/CBMibkFVX3lxTE5zYzQxbDZCQmlQOXh6aEtkV1l3SElPY1R6U2FSSjgzN0s3LU0yR3JpVFlqVUgzS20zSGxLLTZOV083UGY4T2lhLUN5LWN2QmVkZVV6RDFKMVFyRVF0OVNyQlFoc2xVU0dESjJpODVR?oc=5,2023-10-12,DeFi protocol Platypus suffers second flash loan attack in 9 months Blockworks,N/A,flash_loan,flash loan,{},2026-03-06 15:08:50
news,Google News,Understanding crypto hacks and exploits - dlnews.com,https://news.google.com/rss/articles/CBMimwFBVV95cUxQSzZKYkQ3X1RIRVZ3WVdVRnl4Nkkyd1ZLTmFSZWdDSnZlWnpINXF0dUNoVldmTkxzbF82ajFVUHMxdUtwQmc1R2tzTkQxX00xRTJfY29faW5Ga1pkX2JzQWtqQ2FzcGdFbS1zeEpDSHI0UlRlV0h3YmxFUXlkSTBXX3YzdktmZ0hBbkVkZlUzYmtYNnNXQ1p3SndLWQ?oc=5,2023-09-28,Understanding crypto hacks and exploits dlnews.com,N/A,unknown,exploit,{},2026-03-06 15:08:38
news,Google News,What Are Flash Loans? – Explained - vocal.media,https://news.google.com/rss/articles/CBMibEFVX3lxTE1VaGhDUHRvQkhicXFDeU5DWFdjSm0wOUU1eV9MTy1HYm43cHBSa0NxZEpfZnFZYVhLSVR1UkRFbTNjSTdONWtYQVNVeWdkU1lPTTBXX2I3V1hMc0hEX2Z5cmhRSWpyTWZSOTBWdQ?oc=5,2023-09-17,What Are Flash Loans? – Explained vocal.media,N/A,flash_loan,flash loan,{},2026-03-06 15:08:50
news,Google News,FBI Confirms that North Korea was Behind $41 Million Stake.com Exploit | TRM Blog - TRM Labs,https://news.google.com/rss/articles/CBMirAFBVV95cUxPeEVPRC1iTkU4azZJc3dLeEd6aHp3cVRXN1FfVlp6RDJDZ2FFUjRPTmFRVllsMFVSSVYwcDRPVXE0TWxiU2xLWGNmVllHVFVhMWI5UFRYM01MSUtnQkVrQjFWNko3VzFhSGlrTUF1bkVqNnhiazFDbG9vc2EwLWYxNTdRc2UtbGZZRl9iTDRLQVdQaTFBY2lCUUtIRGdYSGM0bHRUQklBaHNYcEJ2?oc=5,2023-09-07,FBI Confirms that North Korea was Behind $41 Million Stake.com Exploit | TRM Blog TRM Labs,N/A,unknown,exploit,{},2026-03-06 15:08:56
news,Google News,Venus Protocol liquidates $30 million in wallet linked to BNB Chain bridge hack - The Block,https://news.google.com/rss/articles/CBMiZEFVX3lxTE9fX2NKOUhlejNER2t2MXhkYU5CMGVhYW0zNVg0STdUaHFZdUJWNmZZNEIxX0hfTkxUdVBhX0cxNVVxRTlHaXZEcXhqcHg0X0FvU3dFS1FpLVBhTVNBOGJZcGR1Si0?oc=5,2023-08-18,Venus Protocol liquidates $30 million in wallet linked to BNB Chain bridge hack The Block,N/A,bridge_hack,bridge hack,{},2026-03-06 15:08:56
news,Google News,"Solana-Based Cypher Protocol Experiences Exploit, Freezes Smart Contract - CoinDesk",https://news.google.com/rss/articles/CBMitwFBVV95cUxOTVVqMWpDLUZjS3o0M0VKdHppVUgyZUpCa25uRlp0c1Z3enM4Q2xmbXNBVE9RVkQxWHpXT3M1eUs5OEVuekJhYmpvNXZycTJJTHZyNzdMVXptX2JtZ0NhdnZoQnJBMXBkMlRoTlNZYWdqZ0VwT1Q2M215YWk1RG9KWnVNZ244NjhDRTI3a0tGQ29Ia0NpWEpsQjFMRHVCVkZJaWpZM0dsZHFkUmtMQjRVbWE1Z0RlaXc?oc=5,2023-08-07,"Solana-Based Cypher Protocol Experiences Exploit, Freezes Smart Contract CoinDesk",N/A,unknown,smart contract,{},2026-03-06 15:08:38
