category,source,title,url,date,summary,amount_usd,vuln_type,keyword_matched,extra,scraped_at
news,Google News,OpenAI and Paradigm Launch EVMbench to Stress Test AI on Smart Contract Security - unchainedcrypto.com,https://news.google.com/rss/articles/CBMipAFBVV95cUxOT1lVS1BHblg5a2E1QTA2WUJFNzhhSk41NEdHR21vR0ZEZmQzbFNyV3kxTFFfTlRwaDJ5M0VMaWJTX0x0Nl9jdWtCTFVsbUNGRzIzSzRqZzBFenJOTzF2dHh0T0RtT2w3MEllZkhKR0F0aVlwTnNnV3BibldyWm11ZnFDaXJobjU4QWhkZDZlTlpoV0F3NjBaOWJDZ1lMUk5OMHh4MA?oc=5,2026-02-19,OpenAI and Paradigm Launch EVMbench to Stress Test AI on Smart Contract Security unchainedcrypto.com,N/A,unknown,smart contract,{},2026-03-06 15:08:41
news,Google News,OpenAI and Paradigm launch EVMbench to test AI agents on smart contracts - TechInformed,https://news.google.com/rss/articles/CBMinwFBVV95cUxNNnJsR1lXQVc5eDBHTjcwMk1rMkI0eDZJNFFWdG5pYmV3d1JnQ0dGSWNySmVmQVI1c1FVSVZxTExCaUxlMlJuem9WZGF4SHc3UFhEeEpiSmlSZU1yOWN4TEd1Q3NnZ20tRk8xYmxUU1hVNnF5Xy14LWttZXlZajRNSG1IRG9RbnRmaGwxNjI1a1RTRGpQcy1VNExCb1NiOFk?oc=5,2026-02-19,OpenAI and Paradigm launch EVMbench to test AI agents on smart contracts TechInformed,N/A,unknown,smart contract,{},2026-03-06 15:08:41
news,Google News,OpenAI Launches EVMbench for Blockchain Vulnerability Detection and Exploitation - Cyber Press,https://news.google.com/rss/articles/CBMipwFBVV95cUxNVVYzbzhwdE1SSE1zRk9UMVRPcmstN3VkcjRZaTVjRGo0dXU1VFQwZlY5eTJLYnJhbUhGZnc2OUw3aUd1VVJxWHJQbnBjUVk5SkFaZmpvOEVXeEdWZk9iQ1FPN2lvRExKRXBTRUFZU1ZMczVvWmVDR1pqdEt3NXRkTWxKS216VEVzTnJFUHFXVDV4RW1HVDFrdlRWaFpwMDBaVXQ1Q2k2WQ?oc=5,2026-02-19,OpenAI Launches EVMbench for Blockchain Vulnerability Detection and Exploitation Cyber Press,N/A,unknown,exploit,{},2026-03-06 15:08:41
news,Google News,OpenAI and Paradigm Launch AI Tool for Smart Contract Security - Coinspot.io,https://news.google.com/rss/articles/CBMinwFBVV95cUxPWWszU0p6VDRmcG9WemUwUHd4QVE0WENaQzJIZmFRdUx1bDBXR1loQzBpYUQ3LW9tRHlrY0t0djZiaXFLRlEzdkFCeHRGRDQzZmVaQnZieEtGRTdxMk51aWNrQ0E3NThqLWdzcmVINzljNGhlbmduSl9VUFcwbEhGV2czRDhpNm1mMlpyUTZEcDI2QThPN0xPZkxfeFJUaDQ?oc=5,2026-02-19,OpenAI and Paradigm Launch AI Tool for Smart Contract Security Coinspot.io,N/A,unknown,smart contract,{},2026-03-06 15:08:41
news,Google News,"OpenAI Launches EVMbench to Detect, Patch, and Exploit Vulnerabilities in Blockchain Environments - CybersecurityNews",https://news.google.com/rss/articles/CBMiWkFVX3lxTFBfMFZPT3NIQ0FZQjFheGk5OXFHei1rTjVCMTlKbEg5enQ0TmxmdDJRLU9HSVpMY0JPeDJPRHlKQ015U1lVQmhhQWdCMWpxcHR5ajZTbnJHTkZsUdIBX0FVX3lxTFBrYUE4amJETGZ5TVdZb2dHQ3BGcmhNLVFlX3dWQTY1dmMzcC1FR2tnNk1DUjhCWFhlMG5wX3p3R3ZZTVpnRzAtYVlyM0czV2NraUgtbHl3M3E2eHFyTng0?oc=5,2026-02-19,"OpenAI Launches EVMbench to Detect, Patch, and Exploit Vulnerabilities in Blockchain Environments CybersecurityNews",N/A,unknown,exploit,{},2026-03-06 15:08:41
news,Google News,OpenAI and Paradigm Debut EVMbench for Smart Contract Audits - SQ Magazine,https://news.google.com/rss/articles/CBMifEFVX3lxTE9wWTJfNDI5UXJnUEhQVnZBVVNuWllGLUY5TXF3Um1JWGxjSGFpX2RvWDdXRUI3TGNRNUdQSXpkWWpfYXZ2TmxmVWZubkVoY2YxWWZoYllWOGpvNnYyNF9sYVIzU0N3VkdtTXVpbEJiRV9ybDRqVUx6SWZRRVg?oc=5,2026-02-19,OpenAI and Paradigm Debut EVMbench for Smart Contract Audits SQ Magazine,N/A,unknown,smart contract,{},2026-03-06 15:08:41
news,Google News,"OpenAI, Paradigm launch EVMbench to test AI agents on smart contract flaws - 디지털투데이",https://news.google.com/rss/articles/CBMiuAFBVV95cUxOWEhmU1J6bzdXcW01VWd1cEFFLU5RTXdDaUtORkZwbUliMjJvT3F4ZUYwNHRUR1c0bnhQaFdDVjREbkdMalhUR3hyZXliR2ZOSlVBQXlCWU9YNC1uTmszc1Y4QV96MHM1VDZYOUs1LTdIZDZZTXNfcmFhRnk2MU0yZkZUMjBYNGhqbk9WUWZsb0VBYzdEcjJ6R2RnWHFLN3dVT3hFZTBUQjJzOXlrNlJRcTNxTHJIc2NQ?oc=5,2026-02-19,"OpenAI, Paradigm launch EVMbench to test AI agents on smart contract flaws 디지털투데이",N/A,unknown,smart contract,{},2026-03-06 15:08:41
news,Google News,ChatGPT and Paradigm Launch EVMbench: AI Tool for Smart Contract Security in Crypto - EGW.News,https://news.google.com/rss/articles/CBMimwFBVV95cUxPOThhT1ZPVlc5UzNnNUpRTXpMbWVRaFF3QllPR1Y5elczc2hib0dDUmZHX3RLOW43em1rbFRPdmViQW5wclkyUVRPOUI3MWRPMkVkczR4Y19pRGlHazhkR0FMdmdhRmpjRk5GOXZLWGgwcE01akU3YXNhZndiQ0dkb081aHVhYl9US0tkUm82eXNlX1Zmdkdadk5YWQ?oc=5,2026-02-19,ChatGPT and Paradigm Launch EVMbench: AI Tool for Smart Contract Security in Crypto EGW.News,N/A,unknown,smart contract,{},2026-03-06 15:08:41
news,Google News,OpenAI’s latest paper exposes the risks of AI in smart contracts - bitget.com,https://news.google.com/rss/articles/CBMiXkFVX3lxTFBiUFZMdld1WGlXS3FrSVdWemdGUWN4ZlJnekxhck5CV2xTNTFweXpvYngzSU9pbFlIaDFoZ3pZS0tsS29XZm9TOGZndThXSTk3UEVQeFJPaV9zd3cta1HSAWNBVV95cUxOamtOSTI5R1ZOR2FnbHZLWFNGbzBHcDB2eUl6VlYzaHQybC1Gc0k0MWZLUnMwYk5iY1Q0VjViZkpfeVRSaGZOMHo4Skh4Ty10cC1HS1hwTXFHQ3J2R1VPUkFOQW8?oc=5,2026-02-19,OpenAI’s latest paper exposes the risks of AI in smart contracts bitget.com,N/A,unknown,smart contract,{},2026-03-06 15:08:53
news,Google News,OpenAI Rolls Out Security Benchmarking System for Crypto Token and Smart Contract Security - bitget.com,https://news.google.com/rss/articles/CBMiXkFVX3lxTE9yOEszczZOajZXcE1XQVpDR0tjT3ctTS1xRUlpSV8xN0M3OFdCdXpmY3haNmxoUVRlbGpoS0RMT3pKV1V0MlRyTkZkc093U3dhX2lZUWx3dlVUSmZsZ2fSAWNBVV95cUxNM2x2ZGpxdlVCeV9CdHZqVTQwMzlDeEZyTy0xZERNX3N5WnU0NUF3OWlGa05OWi03UEZKaFpaNERzM2JHTHlxa0l4dnZINXd0dzJyeENEU2RvaF9Za05oUTZVRDA?oc=5,2026-02-18,OpenAI Rolls Out Security Benchmarking System for Crypto Token and Smart Contract Security bitget.com,N/A,unknown,smart contract,{},2026-03-06 15:08:41
news,Google News,Anthropic’s Claude Opus 4.6 blamed for Moonwell’s $1.78M loss in smart contract exploit - CryptoRank,https://news.google.com/rss/articles/CBMiggFBVV95cUxQcEtnYWtZblJiRzdONE1mTVdLZU8xVFBHdEJuX0o5MHdXanlBRUwwVFpsRm1ObFF1bGw2elBnOXBuVjVRVWJaVV9OYzktTFloOUNYNlZJMDJ5TkYtVU83NE9xNzhwTG5pYWZrVDBrRVFmZENVZGpXaGItWDZwWnBmc25B?oc=5,2026-02-18,Anthropic’s Claude Opus 4.6 blamed for Moonwell’s $1.78M loss in smart contract exploit CryptoRank,N/A,unknown,smart contract,{},2026-03-06 15:08:41
news,Google News,OpenAI and Paradigm Unveil EVMbench as AI Takes Aim at Cracking Smart Contract Bugs in DeFi’s Biggest Stress Test - HOKANEWS.COM,https://news.google.com/rss/articles/CBMiggFBVV95cUxQc3BNUmNwazlWNXFkRHZSX3ZPamo3X1NqTlRUWkhwNU1zVlRGSzlPUUtZM0RubEtDX3dQYk9zZ1lnMkxSb0M1Y1cwR3BuVkVUblk0Vm1UdmFzYklsOFcxSjFaMGhZbUkyMjZxT0VFZVo1VTZJRGVFV3V0S1ZCZElySmZR?oc=5,2026-02-18,OpenAI and Paradigm Unveil EVMbench as AI Takes Aim at Cracking Smart Contract Bugs in DeFi’s Biggest Stress Test HOKANEWS.COM,N/A,unknown,smart contract,{},2026-03-06 15:08:41
news,Google News,Moonwell hit by $1.78M exploit as AI vibe coding debate reaches DeFi - TradingView,https://news.google.com/rss/articles/CBMiywFBVV95cUxOTGdkYmJ1cTJxT0l5RjdFaGtaVXhXZ3k5TnMtV0N3U1kyc29TWlpIUU1aUjVqa1RQTEV5MmRRbjNldks5R0U5NWkzY1pmWDJFMWZhLURoMEhKel9VUFpoeF9WZkFXUm1hVVNZMGJFSlY1ZXlGVjlTQjBqQW9qX1ZOamY2cEN5SmUteW56bkMtRHFvR1haQnNhemotcTU4MnZtS1pTWDFmMnk5UllYWUxxbnhUZlk5czdFekQ0YmQ0ZTBCaUo1TXJpWXRCSQ?oc=5,2026-02-18,Moonwell hit by $1.78M exploit as AI vibe coding debate reaches DeFi TradingView,N/A,unknown,exploit,{},2026-03-06 15:08:53
news,Google News,Claude vibe-coded smart contract cost DeFi protocol $1.8M in losses - Cybernews,https://news.google.com/rss/articles/CBMinAFBVV95cUxQT09lVjBFeXVCenpGMkItLVRTdVFGQXJ3RTVBMlZfTC1BckZKOGliTHFqZnpOdDY3Vm5SVU1NUm03UHZzcmVma0drbFNORWtkSHhFdGR2bmlPeWZ0Z21ickFZcHpvOE8xM1hPcmJZdlFvSHBkZ0NyaWhIZTlRNi1xUmJpVkNPMTFPcGVjTkZINno2eElVQkEyb1F2TTI?oc=5,2026-02-18,Claude vibe-coded smart contract cost DeFi protocol $1.8M in losses Cybernews,N/A,unknown,smart contract,{},2026-03-06 15:08:53
news,Google News,Anthropic’s Claude Opus 4.6 blamed for Moonwell’s $1.78M loss in smart contract exploit - Cryptopolitan,https://news.google.com/rss/articles/CBMieEFVX3lxTE9mXzU0LXZWM2hhUHFub0JJNGRPbENMWDdXZFByMm01N3ZrUlhwT25Wd2JyQThoUWpiTmpKQzZMaGpzSVlYX3prY1ViTEJQa2RsVGdsSmhKbkJWcGdGbUlWZkF1SE9VVmJ6VEh3UFRLV3k3Umd0ODRjRg?oc=5,2026-02-18,Anthropic’s Claude Opus 4.6 blamed for Moonwell’s $1.78M loss in smart contract exploit Cryptopolitan,N/A,unknown,smart contract,{},2026-03-06 15:08:53
news,Google News,Flash Loan Attack Drains $438K From SOF and LAXO on BNB Chain - The Crypto Times,https://news.google.com/rss/articles/CBMioAFBVV95cUxOVkV4ZzEyQjZmQ05hR1NBQTdqd19NQlF1djhLMmdnWmM5Zm9XeVhfdVFxMmlpUjNCU3R4VnBCeURhel8yMWw1OHZYeXc2dlZYS0lXZG1TSngtQ0h3MkR5RTQ2aVVYdVpqbWY1ZENkT2NGaVNQVXJGNFRPNDF6Q1FUSW9vSzhOak45X2tQRERWR2JLdENXT043bU5YVG1Oczds?oc=5,2026-02-14,Flash Loan Attack Drains $438K From SOF and LAXO on BNB Chain The Crypto Times,N/A,flash_loan,flash loan,{},2026-03-06 15:08:51
news,Google News,"Aperture Finance Hit by $3.67M Smart Contract Exploit, Funds Laundered via Tornado Cash - Coinpedia",https://news.google.com/rss/articles/CBMipAFBVV95cUxONmlPdDcyQjRIZWdnRWo5amdkM2ZHSWxNSzdDV25Ca3p2RjhTYkxMMGV1bHJBN2lHdU9VaGRVNkxvSHA4ZGdIRnZaNlBLNTQ1RGd1T205R1VsYm9fd1p2ZU94VlFpT3l6bzJTam1BYXF2aURCRzFRV2VDUGpzTGJoUzVYdVUydl9xUWlrN0lCZ0JOWmtLaVh5UElUSzdRZXVIR0hNWNIBqgFBVV95cUxQQ0hvdEU1RGt6Q2FqTEtlT1hsX1lFSVdpYXZIaU10VmxydzE4aU50Z0l0MlRSdjFNMmRqWEpkaFVHbGxfdUFsTGJPWlo1SWQyMEgyMDZPLU1xZ29fUnpoWVdUYldKZ3kxX05VUmtlYzRvTXVmX3JfSXR1dkQ2OFhUdTV4OU44dzNqZTlieW1mbmw1TUhtbEVGSndFR2xHYllFNnBldjZ4RkJqdw?oc=5,2026-02-05,"Aperture Finance Hit by $3.67M Smart Contract Exploit, Funds Laundered via Tornado Cash Coinpedia",N/A,unknown,smart contract,{},2026-03-06 15:08:38
news,Google News,CrossCurve bridge loses $3 million in smart contract exploit - SC Media,https://news.google.com/rss/articles/CBMikwFBVV95cUxQanVOR01aM0x6NUstUWV0dlBWTG54ZGlxdmpuNkxweVJpZ01zSjBOMHNhNWJ6UUtwYjlCemFncnpCMHIxc3U4WEpDZTMwVGF2bHBsZEJrVzNEWWlYckxYZGhLbi00R25hU2p5cl90WkNweEdud0NxdUdtUGdINzZ3LS1FLURZNjdXQVgwZ2oxSzc4aGM?oc=5,2026-02-03,CrossCurve bridge loses $3 million in smart contract exploit SC Media,N/A,bridge_hack,smart contract,{},2026-03-06 15:08:41
news,Google News,CrossCurve identifies 10 wallets involved in the $3M bridge exploit - TradingView,https://news.google.com/rss/articles/CBMiwAFBVV95cUxQWC13aXFnU0pXNjFRVXRMUW15cjRGYlBuaVhkcVUwNDRJTllhUE9jWHVWYVFOWV90eDBlbWpZRDJ4X3Z6RE1QOE14V3RQcFN2cUZ4b2xvS0NjWUlEWm9zT2RDdjRxRWRZaG1lcmFRVnNWcHQtVTBVVWYxRlZQTHJRY1pFUWI2YXBERVE5NjlJb0VPZXVnSmc5VEZ6Z1pBNkRIUjZnR040V2pCOVA3cUltd09fWHBHNzJBLUFvNWluSW8?oc=5,2026-02-02,CrossCurve identifies 10 wallets involved in the $3M bridge exploit TradingView,N/A,bridge_hack,exploit,{},2026-03-06 15:08:41
news,Google News,$3 Million Reportedly Lost in CrossCurve Bridge Exploit - BeInCrypto,https://news.google.com/rss/articles/CBMiZEFVX3lxTE83WXdfU21Fc2pPamRDVXYyUDRWYU1XMWRFem16Tk1lanQyQUtMbGd4bmtKa1J4eXVoRC1RTGlBMzc2bkhsX2daSV9zN3BaVWVidUhRUVRGNkRsUld2WjVvRnJrbzk?oc=5,2026-02-02,$3 Million Reportedly Lost in CrossCurve Bridge Exploit BeInCrypto,N/A,bridge_hack,exploit,{},2026-03-06 15:08:56
news,Google News,CrossCurve Warns of Potential Lawsuit Following $3 Million Cross-Chain Bridge Hack - bitget.com,https://news.google.com/rss/articles/CBMiXkFVX3lxTFBDajQzMElBYWNBdFJNcXVVQVZtVkpkU0dTVkNIWms2Q0JrdjI1MTlfT2dZelo3dmRDV0luMzg2Rmo2Qkk3VHEteHo0OGRjTXBCbzhaU19wMzBaVElPTmfSAWNBVV95cUxNRlBZcG9yRG1WdG5IRUpiRkZ6MDdSdEQtRGxuRTViWU1uZUQ2TFdqU0Y1TTZzWDVBd1E0MXZZUmNhMUFrV1gtVEJrMGhJQWdobnNiQ1JucGhwaWVkNDE2MDFocFU?oc=5,2026-02-01,CrossCurve Warns of Potential Lawsuit Following $3 Million Cross-Chain Bridge Hack bitget.com,N/A,bridge_hack,bridge hack,{},2026-03-06 15:08:56
news,Google News,CrossCurve Bridge Hacked for $3M After Smart Contract Validation Vulnerability Exploited - The Cyber Express,https://news.google.com/rss/articles/CBMibkFVX3lxTE81U256MzBzMVVqWVZwWDhtM3pGMkNnTkdaRDlGa2haa2ViVTRQM21Gd3ZSRlBKeGF2WC1GTkRqRHJkMDU3Vk1Uc1dXdHVVQkdRN003ei1MTWdtRHU0ekpGWHZTRmtZSk4wemxTR21R?oc=5,2026-01-31,CrossCurve Bridge Hacked for $3M After Smart Contract Validation Vulnerability Exploited The Cyber Express,N/A,bridge_hack,smart contract,{},2026-03-06 15:08:38
news,Google News,Recent Smart Contract Vulnerabilities and Industry Response - vocal.media,https://news.google.com/rss/articles/CBMikwFBVV95cUxPaEtDMVZwRWZzSXRZWTU5cU9wVTBrM1RNT3JtaU1MUlZ0cTZVVThhVzhEMlVvX3ItM1k5enJUOHJvZUZJQ19ZSXl4RmJXbW5TLVQwX1A0aFNmNWxiRVRDRXhSZHB2NVk1emJOZ3ZrY0NxMS05Zk5lRkQ5Ykk2ZHI4dU5PVDhvSndRWVBRdVktaTNxRDQ?oc=5,2026-01-27,Recent Smart Contract Vulnerabilities and Industry Response vocal.media,N/A,unknown,smart contract,{},2026-03-06 15:08:41
news,Google News,Matcha Meta Hit by $16.8M SwapNet Smart Contract Hack - KuCoin,https://news.google.com/rss/articles/CBMijwFBVV95cUxQMUJYM2dzTWM4cVlYS3V5dWJ1bTdkQzA1cHJldDVPeXJCMUp6WWwwMzE0V2tnQXV5NnN6VGxrc3VPbDdQRWVzMUpBRm9jQ0hpbmpOYlR5UGh5c29IbDMtdmhDTkN6NU5pUWxxQTFxTFRjdi0ycFhBOUhURE10OTRHQTZqckkybG1MSjhMeUJoTQ?oc=5,2026-01-26,Matcha Meta Hit by $16.8M SwapNet Smart Contract Hack KuCoin,N/A,unknown,smart contract,{},2026-03-06 15:08:38
news,Google News,Matcha Meta breach tied to SwapNet exploit drains up to $16.8M - TradingView,https://news.google.com/rss/articles/CBMiwwFBVV95cUxNV1RzTFNUcy1MaXZEZnpTbjlJQUhNNWV2bnN0WVB6MWozcVdTQnN6b3Q2TnR1dlk4cWg2aU1CY0JZYjgyWU9sSmJVakhmMFBlUEw1clhsTkQ1OF9GYUNsYXBwX0Y4SVpzVmw2Vk9TX1NzWGl6VVpkSFJ0VXpCSnZmMmVqWEEwa0pjOWs3N1VtdXhBbW5GQ25HV3VVUHBGZnFReWNybWdJdUJtNnBHLWpVODRkUGNuVWFJTGxFZDN3dk5PbGM?oc=5,2026-01-26,Matcha Meta breach tied to SwapNet exploit drains up to $16.8M TradingView,N/A,unknown,exploit,{},2026-03-06 15:08:41
news,Google News,Saga pauses EVM chain following smart contract exploit - The Block,https://news.google.com/rss/articles/CBMia0FVX3lxTE9HU243cFhjTG1ZUGRPdGFldGgwTVBlaldwaGxYbDVzdUNHQW1PcUtENTJMRjJGQ2p4ODBFeUNvRXF3X1ZfY25mZVFhZ2tsZWcxSkhLSXlLU3JlMlJsQVdqb3M4WVVoVW5SQVQ4?oc=5,2026-01-21,Saga pauses EVM chain following smart contract exploit The Block,N/A,unknown,smart contract,{},2026-03-06 15:08:41
news,Google News,A Massive Security Breach Hits Makina Finance: $5 Million Drained in Flash Loan Attack - bitget.com,https://news.google.com/rss/articles/CBMiXkFVX3lxTE1EZWN4cmxVWnJYNDFqTVFubS10eFRoMlRfR1AxXzB0UGl0TktLLUxMME5mMnZkcHd5VEhZbWZfVjZLT0d4eDBSVHRKajJ1MVh5dUd1aTViRFBlY010WGfSAWNBVV95cUxOSEt5cjJRSEF6RmwzR1hubVk2b3RQUkxDY19hS0RpRHNzUVpuTm1yMUhpenN1LWh3WG02eUpQRDY2MWVKeTdZUFNoRGJoWFRsUGxwTVVBbmRINnFPS2d5T2I2RHM?oc=5,2026-01-20,A Massive Security Breach Hits Makina Finance: $5 Million Drained in Flash Loan Attack bitget.com,N/A,flash_loan,flash loan,{},2026-03-06 15:08:50
news,Google News,"DeFi Protocol Makina Suffers Devastating $5M Flash Loan Hack, Exposing Critical Oracle Vulnerability - bitget.com",https://news.google.com/rss/articles/CBMiXkFVX3lxTE40WXowblhvWHlEaEpmUVN2SUhNSFdvejNobjFzTG1BMUIxUDJkUS1ncnVFUU0tNkIzWW43N3hPN3laSWJ1b0tmTVB4YmdfVTZpTlZmY2pyUU53YUNmX0HSAWNBVV95cUxPTU9oWFZSM281Q2M1NWE3SmNJVFc3RGRtM3JCWTFHWDMweXZZdXA4dGs0NlJmTHZCZHFVNG9lZl9zSGZiR3g1OTB0enZ5QURNRUxPWlZpU3RzUGNvUVBXVDAzVEU?oc=5,2026-01-20,"DeFi Protocol Makina Suffers Devastating $5M Flash Loan Hack, Exposing Critical Oracle Vulnerability bitget.com",N/A,flash_loan,flash loan,{},2026-03-06 15:09:00
news,Google News,"DeFi Protocol MakinaFi Suffers Devastating $4.1M Ethereum Hack, Funds Drained - bitget.com",https://news.google.com/rss/articles/CBMiXkFVX3lxTE15M25MZDRmTldOcUpzNUx2RnVhX3g4R1pkaEtENHJKdmNIMFpvRktYaXJzSC1LaHc0UVlqcFNvUWt6OTRiX0FGOWlLemdmRm1ONjZGRHlYTmhEd2VqY1HSAWNBVV95cUxPOWwzU1pnWWEzNXp5RjBfYVdaenBhTTQ0RGQteUVjU1c5aUhlZ3pDT080cFljQjVWSlh0d1YzMTZMdUFiZjZvRENpM0IwUjY4VjNWY0tkYlNRM2Y3NDBURnc3NHM?oc=5,2026-01-19,"DeFi Protocol MakinaFi Suffers Devastating $4.1M Ethereum Hack, Funds Drained bitget.com",N/A,unknown,ethereum hack,{},2026-03-06 15:08:38
news,Google News,MakinaFi Exploit Drains $4.1M as MEV Bots Front-Run Transactions - Coinfomania,https://news.google.com/rss/articles/CBMikgFBVV95cUxNb2pWVTR1amJsR0M1ckZRM193aWtJWl9IcmlVcEtkLXp2VEdSWm45azVucFAzelpzNVdzS2FicmVfNE8zRHZjOEYyRGZNbk53VmVkX3JMdVZmYVBQLW5kbkRxbDluSm81b0IxY1pfSXRFSHZ1RnN3ZHoxOUoyWmZlR2x4UFZ1eFpzNGhRLTYzamJZdw?oc=5,2026-01-19,MakinaFi Exploit Drains $4.1M as MEV Bots Front-Run Transactions Coinfomania,N/A,front_running,exploit,{},2026-03-06 15:08:51
news,Google News,Most Common Smart Contract Attacks: Learn How to Spot and Prevent Them - Coin Bureau,https://news.google.com/rss/articles/CBMidkFVX3lxTE9fREYyRktpcHhvZUdHU1REMWx3akRRVG5FZklhbmpNeVhfSVNzM0dNTDY5LUkxTjJ6WVpGbDRESFE5V3ptTC0yaHZJTWtyNVktbXNFb2lIRUw0c09tYThZREtKRmZlRHNLVTZsR0l4OW9mMF9sRlE?oc=5,2026-01-16,Most Common Smart Contract Attacks: Learn How to Spot and Prevent Them Coin Bureau,N/A,unknown,smart contract,{},2026-03-06 15:08:47
news,Google News,Truebit Hack Triggers $26M Loss as Legacy Smart-Contract Flaw Is Exploited - Trade Brains,https://news.google.com/rss/articles/CBMipwFBVV95cUxOdVRnQzdEcW5QNzF6Rzljb0lsWjRMa1h2Sk1Nd3l5Mk9XTjdLM19TbzVxdW91cjQwbzJTa0ZDZHVyY0dEN0VJQlNWeEtreS1jdDlpdGxMN0xLbGtDbFM0RDBNVWZkR0N2b3NpaEk0SzlISUUtZEx0QkpfTzhfOVQ4SHdHbG9TZmdpQjZZUHFCbUpONm1XTnFELXMtSFlQVXFDTFU4ZGcyOA?oc=5,2026-01-14,Truebit Hack Triggers $26M Loss as Legacy Smart-Contract Flaw Is Exploited Trade Brains,N/A,unknown,exploit,{},2026-03-06 15:08:38
news,Google News,Truebit exploit exposes smart-contract flaw behind $26M token mint - TradingView,https://news.google.com/rss/articles/CBMiyAFBVV95cUxNUzh5cFNkNkNOS3l3ckJ3aHM4Zk1TWFVVZDV3dTFySm5LdUkwYnVrYlVWVlRZc215TzhqNlZkdERUZlJXbXhScGkwVVJLV0NnLUFEWTJBWnhqQTBhNDk0QVFIZFBUZUN4bHh3SElsQlJ0OFpvb2FscjhPY092eVFzNzZXOHpoakRXYm1VbzRYY09jNEkyTDRacU94QWlaalpuVE5SMVdZRjQxdFREWWVqcmtuMmJFc1kzZVZ5MVpTcHg5azNoRDJ3Tw?oc=5,2026-01-13,Truebit exploit exposes smart-contract flaw behind $26M token mint TradingView,N/A,unknown,exploit,{},2026-03-06 15:08:53
news,Google News,Truebit TRU Token Wiped Out After $26M Exploit Hits Smart Contract - SQ Magazine,https://news.google.com/rss/articles/CBMiZkFVX3lxTE92bmVaTGt3b1dqaFAxam9CNmo4cFFnRDRxSHhkSEY2cHBKZkFLYy03SFk5eWlPQ2ZmOTNaS19Yc0dQTDlNczZyNTBfTWVKQ0ZSbm1PVExxemtWN0tnNUk1YTU5VG1PZw?oc=5,2026-01-09,Truebit TRU Token Wiped Out After $26M Exploit Hits Smart Contract SQ Magazine,N/A,unknown,smart contract,{},2026-03-06 15:08:41
news,Google News,Truebit token price falls 99% after reports of $26M exploit - TradingView,https://news.google.com/rss/articles/CBMivgFBVV95cUxPV2R0LTRZaElvX2V4X0hlTDNZVTNmS3F6VFBvTk5ieXRXWm9uOGRxZkpLWTRBeUw0UkExb1hmRUtDTWlYc3RpVFRxXzhxMW52amFzMkNyZGhYY3R5dHdFM2JaMi1QRERtRHl3UFU0ZkFfamNwOU01NnFpUmdldm1sWXpKUFpmdmh1bmI0QTFMQmJxSEdYZldQall3aW0zc3NicW9rTEZxWHBQdUFfbDNkbUhMNEFPdTVkcFZUMlZ3?oc=5,2026-01-08,Truebit token price falls 99% after reports of $26M exploit TradingView,N/A,unknown,exploit,{},2026-03-06 15:08:38
news,Google News,Truebit's native token TRU plunges 99.9% after $26 million exploit - The Block,https://news.google.com/rss/articles/CBMib0FVX3lxTE5WMFZrbDZCZnp4UVE3QWdWYnJ3bW5qeGdEb19PRlZkYjgtWkhzTC1RUzBRdmh0eXdrQ1FxZ04zUVVFWkpfQTVnWUFyRS1pdGpYbHYwaDZIQmNwS3RVbnZXSUhUeHJvUGxFYmdFMzJOOA?oc=5,2026-01-08,Truebit's native token TRU plunges 99.9% after $26 million exploit The Block,N/A,unknown,exploit,{},2026-03-06 15:08:41
news,Google News,What is a Flash Loan in Crypto? - 99Bitcoins,https://news.google.com/rss/articles/CBMia0FVX3lxTE4tYXZoOGo4VWptdE5fWXRNUmdHcWt4Nm1ZUUxJN2FnRjRtNFRpVEZqRnRJYUZTSWRFRDlYS0w5WVU0ZmdRNThaQzVxeUJneURGdjdmLVQtbllUcl9hZjRZVUdoeXhoMmpmak9R?oc=5,2025-12-22,What is a Flash Loan in Crypto? 99Bitcoins,N/A,flash_loan,flash loan,{},2026-03-06 15:08:50
news,Google News,Smart Contract Challenges - Hedera,https://news.google.com/rss/articles/CBMiZEFVX3lxTFBjMTRrSlNEUEdUbUZpdDhQMzMxR0xyd0pJdlhFOUh0bGM1YkdnaEw3RGdzMjJ2alVFM3NWRU8tbGlYajhpOWptcUFSMl94V1J1ZWlxOGd2V2l5Umd6a1lhTGhFSnM?oc=5,2025-12-19,Smart Contract Challenges Hedera,N/A,unknown,smart contract,{},2026-03-06 15:08:38
news,Google News,"Alarming Breach: Yearn.finance V1 Hacked Again, Losing $300K in Latest Exploit - CryptoRank",https://news.google.com/rss/articles/CBMidkFVX3lxTE1BeHJUZFNsMzZLTHJDWW54bFd1WlNWRHhRWmZ4VTBPVHpyLXVqcjVhd0dnWDNGczFjLTFLenJRQTY0VzNPQUZrc2tMM0Vwb05XQ2lzZllCZGFlb1hmS25VcTB5bXU3VnhkU2VZVWFrbWxLWUN2dHc?oc=5,2025-12-17,"Alarming Breach: Yearn.finance V1 Hacked Again, Losing $300K in Latest Exploit CryptoRank",N/A,unknown,exploit,{},2026-03-06 15:08:38
news,Google News,Smart Contract Vulnerabilities and Exploitation Patterns: Lessons from Real-World Blockchain Breaches - Blockchain Council,https://news.google.com/rss/articles/CBMiigFBVV95cUxOS2YxWEtqa1pGUUNSc3ZtdzJfZy1VNnFWSnRvcTNHdHhvdnp1RkJZLTdsaTI5aFA4REFIMENaaUVIV0R0eTlzWlpIcFgxYWdnOFhmNVFoXzE0OUItMEwyTVRjN1VBUGZLUGEzZEROc1J1RllTVmFxcHFzMHpBVlFLSFJHSXNPMFhpUUE?oc=5,2025-12-17,Smart Contract Vulnerabilities and Exploitation Patterns: Lessons from Real-World Blockchain Breaches Blockchain Council,N/A,unknown,smart contract,{},2026-03-06 15:08:41
news,Google News,Yearn Finance hit by fourth exploit as attacker drains legacy v1 vault - bitget.com,https://news.google.com/rss/articles/CBMiXkFVX3lxTFBPYUh2ems5VGtTUDQxc01uVkhxSGZMRmpmNm1yQWxMbHlxalV6QUlhWlVTNnZlVkpabmtmVnFKM0h1TllGU3RwWTNVMFFPazFTejJtYnZTOC1NTnRGU2fSAWNBVV95cUxPMWpwUUZ4M09aeGhGN3UyNzBvblgwNTV3NUpaeXlIM0Y0UFA5LVNKLU5seS1FTUY4NlVzVUVtSDd0dlJ0WWJpRDE0azE1RUhRcmh1bEVpR3EzVTZ0NEozRl8zSXc?oc=5,2025-12-17,Yearn Finance hit by fourth exploit as attacker drains legacy v1 vault bitget.com,N/A,unknown,exploit,{},2026-03-06 15:08:50
news,Google News,FTC Compels Nomad Operator to Repay Users After $186M Crypto Bridge Hack in 2022 - bitget.com,https://news.google.com/rss/articles/CBMiXkFVX3lxTE9qakdlV0lsUFlwSk1EWTd1emIzZ09vcEp4X3huT21yY3ZwOF9FNlVOSnJIMG10UDZ4VXN3OWU0UTA3UURqTWR4cEhRaldnNmNBenB5UHQ3b1paODRFRnfSAWNBVV95cUxQRmlqN3I3dGhQMzliTUFnbzVPeU1MRUpHNFVOeEFqN3U5ak8wMlljdUtkb2lDRHh4ajNkUG1JZGNDX1FkQWFubDlXcHdxRENKNUVVR3dKUTJYVWZkeWVCOGhwOTg?oc=5,2025-12-16,FTC Compels Nomad Operator to Repay Users After $186M Crypto Bridge Hack in 2022 bitget.com,N/A,bridge_hack,bridge hack,{},2026-03-06 15:08:56
news,Google News,Aevo's Ribbon Vaults Lose $2.7M in Oracle Exploit - CoinMarketCap,https://news.google.com/rss/articles/CBMimgFBVV95cUxOR0N3NUVpRXVsR0JOU25PeFZKVjdXcjlUQ1NmekV5R0ZwNEFtUkJLVi1sZ3hZYUtQck5JSDBzdl9pSXZITC1TX1lNTTdGM3RvM0Jjd1dOUllHdHRrczAydm9qVE40V1UxQkxfOHNNMzdNUjQzVTZJU3ZhMjZRcUwyRjVscG83cWZmQkJvV2FYWVRlZ0FvbVdfUmRR?oc=5,2025-12-15,Aevo's Ribbon Vaults Lose $2.7M in Oracle Exploit CoinMarketCap,N/A,oracle_manipulation,exploit,{},2026-03-06 15:09:00
news,Google News,Aevo DeFi Loses $2.7M in Oracle Manipulation Attack on Options Vault - Bitemycoin,https://news.google.com/rss/articles/CBMimwFBVV95cUxORzlBYlFfYlczUmZvZ1NkdUpwcXA0TGg3NGxONGxCUGJ6Qk1jOEtfUEx2RGhGNkZlRklhZThLZjZvbkpBTTNZVi0wUW1ZN2NXWWFlQWRMeDRtSW1CcGZtd1hTVFBDT3J0RzBVUWdGcC1zcF8tZGRqUENpdU5QQU05SEtZY0QyYVA5NXFLd09Wc0dBTEZVQXJwekphSQ?oc=5,2025-12-15,Aevo DeFi Loses $2.7M in Oracle Manipulation Attack on Options Vault Bitemycoin,N/A,oracle_manipulation,oracle manipulation,{},2026-03-06 15:09:00
news,Google News,Aevo's legacy Ribbon DOV vaults exploited for $2.7 million following oracle upgrade - The Block,https://news.google.com/rss/articles/CBMiuAFBVV95cUxQQVQtWFlxQ2JkbGJWSVhOalNvYUFtVXMzZUE3ZzBMeEVmRFZIVDRVRlZwWnhZcV8zbWxxSU1QcnhnVVFScmF0V0VtUUhPZkFMbDZmYlFCT3gyTFFFTXVBZnRpVENTWDUwLUFTVnY4a0xiM3dJUXFhTl9uSkFNdGFDcEVGNE1lYU5iaWlWNUFqVlkteVEtbFdWV0FlRHpUcFhfSk9SXzZSVjB2NFJTcjJKQk9wQkJlM2Nh?oc=5,2025-12-14,Aevo's legacy Ribbon DOV vaults exploited for $2.7 million following oracle upgrade The Block,N/A,oracle_manipulation,exploit,{},2026-03-06 15:09:00
news,Google News,North Korea-linked Actors Exploit React2Shell to Deploy New EtherRAT Malware - The Hacker News,https://news.google.com/rss/articles/CBMifEFVX3lxTFA3ZktYMFpvOXV2Zm1GTVYwTlFwcTBtNl83d3ZDSl9uUjY1UGJsdEk5N2dPT3ZuZnR5b3lUM0g0Q0xKUGZha1V6VDFwaVRBWWFSMncybVFZNWozS2RnNVhacFpiQUJVNVBRLWFyZXd1RTRRWVoxT3ZCYlFTUXA?oc=5,2025-12-09,North Korea-linked Actors Exploit React2Shell to Deploy New EtherRAT Malware The Hacker News,N/A,unknown,exploit,{},2026-03-06 15:08:41
news,Google News,AI Is Getting Better at Hacking Crypto’s Smart Contracts - Gizmodo,https://news.google.com/rss/articles/CBMijwFBVV95cUxQM1FPamRLM2NmS0hUOXNrM3VpUXEyYkNMM1ZmVWdzaUMxU2FZbmp2UW1qUTF3Mk1IWjRtMnZtdHBOZ1FPMDVPV25FMElrbkZyZ2t6dDFGV2pkZ3ZVTHpvVXZTYk1iLWlfeEpQMGhqYUtKazVPYk9sRFFjdzFSX25JWnB1bDg5S3RlVEhPTGlTbw?oc=5,2025-12-05,AI Is Getting Better at Hacking Crypto’s Smart Contracts Gizmodo,N/A,unknown,smart contract,{},2026-03-06 15:08:38
news,Google News,Anthropic study shows leading AI models racking up millions in simulated smart contract exploits - the-decoder.com,https://news.google.com/rss/articles/CBMivgFBVV95cUxOSDlEanVyZENuU25maGJab1ZXSmI1RTgwbGkwWmhISjVOWm1RQkI1NWo1Uy1lSDJxeVR0bVVzMGtacVV6bTlyN2ltX2pwLXBTLWtBMWhUQjNvejRPSGRWeTg0ZU12aXlVaXpTaHk4d3ZNNTJudlNwRHBhZ2x3VWJEMEZKYW83UUZVendlUVU2RHZmVThkc0dVajF3TmR6QmNkam50NGN4cy1XcWlBTmNhNmhCZ1FmZFEyTzdtb01B?oc=5,2025-12-03,Anthropic study shows leading AI models racking up millions in simulated smart contract exploits the-decoder.com,N/A,unknown,smart contract,{},2026-03-06 15:08:41
news,Google News,AI has successfully simulated the theft of $4.6 million and has learned to autonomously attack smart contracts. - PANews,https://news.google.com/rss/articles/CBMif0FVX3lxTE5YSE1EempjTlNjcWQ4WWZacmI2VWZhVXV3UmFfUHhHSEdPLWZRQnhWVkJpMXdYMDlOOFluS2JaeDY1QW42dHBqSlItT2tmSk45TXBfclJyYUlZNlBPOXBsNlhpMUZFLTdlWkhJRUJuekhHbmtmXzJBS3hkaEM1Tms?oc=5,2025-12-03,AI has successfully simulated the theft of $4.6 million and has learned to autonomously attack smart contracts. PANews,N/A,unknown,smart contract,{},2026-03-06 15:08:41
news,Google News,AI agents spend just $1.22 to shatter smart contract security exposing a terrifying economic reality - CryptoSlate,https://news.google.com/rss/articles/CBMibkFVX3lxTFBxN0xrVFFxY1Ayd3FFTWVBVDNmNE16bTBTNklaaXBqWTdLNkFodWhXWVZtamI1dlg1WXR2OWpVWXZCM0FCMzlEbEVfdHZnLWZZUlMyRDRhWm1ISHU1TDR2WU1WRWwwR0pCbnF3NUhn?oc=5,2025-12-03,AI agents spend just $1.22 to shatter smart contract security exposing a terrifying economic reality CryptoSlate,N/A,unknown,smart contract,{},2026-03-06 15:08:41
