category,source,title,url,date,summary,amount_usd,vuln_type,keyword_matched,extra,scraped_at
news,Google News,Curve Finance Pools Exploited Due to Code Vulnerabilities - Chainalysis,https://news.google.com/rss/articles/CBMidkFVX3lxTE5oVkRBd2F3eUtPWml5Mk1MZmxJc3pYalNTV0R2RGFhdnZiWnJPZVAyMVFhQkM4ZkJDakoyVGROc1FqSWVXZHN1UHoxQmNtZXBKcF8taTB2R3hUeEk1d05nZkpuZHhPb2plQUZyVWpDdDMxeWVHWEE?oc=5,2023-08-02,Curve Finance Pools Exploited Due to Code Vulnerabilities Chainalysis,N/A,unknown,exploit,{},2026-03-06 15:08:41
news,Google News,ZachXBT spotted a possible culprit for the Curve exploit - Coinpaper,https://news.google.com/rss/articles/CBMimwFBVV95cUxNSk5wNDlDUzE0UkdaMG5pS25Ub2VWZ0FjYkVIcDlWNXlCZlVpdjRSdnQ4VXZ2OWhoUmVHNEdUaGhVVFJqOExDUHRhTG9qNnZ0S3c2SFR3T0phVFk1OVlpN3NZOHNsVTM3RDBTenFwUGRzTlZ2dXRmdjk2QjRnMWpVNnpjWlBGQ3BDc3V5VHAyQnNWOUFsOFBrNDBnTQ?oc=5,2023-08-02,ZachXBT spotted a possible culprit for the Curve exploit Coinpaper,N/A,unknown,exploit,{},2026-03-06 15:08:47
news,Google News,Curve Finance Exploit and DeFi Implications - Coinbase,https://news.google.com/rss/articles/CBMiqwFBVV95cUxPeGozaVZSZXVDYjFhR3NtNmFoTDJ6Q0pObnJuM2dqdWg0TUZZQjVhamcxLVplbmdLT2lxM0RQMkdhWkUzM2NzWFpJanF4ODhGQjZuSk5DN3RBTXhjaGh5d0xRZmJCeFFnM1d2dnRhdFpoWUppbDhsbGZzTnRiLWJTYmR5Vm15bzcxTVVqR2dLVVJvRVpaZ0J6UTZ5clloT0NhYlM0QVFHZkVWRms?oc=5,2023-08-01,Curve Finance Exploit and DeFi Implications Coinbase,N/A,unknown,exploit,{},2026-03-06 15:08:53
news,Google News,"Curve suffers $70M exploit, but damage contained - Blockworks",https://news.google.com/rss/articles/CBMiXEFVX3lxTE94Z2c1U1FZX3V2RGJCMmY4YXNTWWRKb2ROaGxraXZJNi1sdkFDTThHaFlEWmJkLWJ5dFU2WHg1Z180cnptejB3clFEZ25VTmdRckp2cmpzZVRHU1RB?oc=5,2023-07-31,"Curve suffers $70M exploit, but damage contained Blockworks",N/A,unknown,exploit,{},2026-03-06 15:08:47
news,Google News,"Arbitrum-based Rodeo Finance loses $888,000 in latest DeFi exploit: PeckShield - The Block",https://news.google.com/rss/articles/CBMiiwFBVV95cUxQM0ZmRlBKT3FIYVFrOWlhQndMUkY0OXlwMkNWUm1PeF9yN3d0VTZ2dW1fT1ktUjhqdzBnT0p0SW9rcl95c1Y0eXBSNXB1OGNibzVUMWRnVS1tYWZrLXBNeFBuVjktRUZEQXoyZHphdkdwM2pQX0V6Z2ZlYnZmY25tZlZYdHp2UzdFVjhv?oc=5,2023-07-11,"Arbitrum-based Rodeo Finance loses $888,000 in latest DeFi exploit: PeckShield The Block",N/A,unknown,exploit,{},2026-03-06 15:09:00
news,Google News,Multichain Exploit: Possible hack or rug pull - Chainalysis,https://news.google.com/rss/articles/CBMib0FVX3lxTE5HR04zTXljVFM4X1Q2RDlCMXlySkItcHlkS3NLWVpJLWE4NFNlelFsU04zczNxVE9hTGlQaHFEck5sRVhBenBxbzNnOU1pSC1hNHMxMkE2M2RRcktlNldWT0xuMXdzR2lUOTdtMDRKZw?oc=5,2023-07-10,Multichain Exploit: Possible hack or rug pull Chainalysis,N/A,rug_pull,exploit,{},2026-03-06 15:08:56
news,Google News,Jimbos Protocol hit in $7.5m DeFi flash loan attack - theregister.com,https://news.google.com/rss/articles/CBMidkFVX3lxTE1YZHlPbUU2UVpOVWItQkpMMUxVV3YwSlBBSnFxbnlyNExmVHhiaE5GUnlFNHhxOHRITEs4TXlzcXlyTFFJSFhlUEdjVFNLeXJzOU5TLW0wdGUtdGRHMnZDMzB2SVJUVHM3YzJSeTNqZkJIUTI2dGc?oc=5,2023-05-30,Jimbos Protocol hit in $7.5m DeFi flash loan attack theregister.com,N/A,flash_loan,flash loan,{},2026-03-06 15:08:50
news,Google News,"Flash loans, flash attacks, and the future of DeFi - Bank Underground",https://news.google.com/rss/articles/CBMilAFBVV95cUxNNmpiXzRTdkFUNm05VTJVeTg2NFhpZkdGRzNDMEM1WHRPUFdUdnJ3Y2FHV0lnNDl4LV94bTdfZE9LTzN4VGZrcDl0YlFBS1pCeEJfRlVRUExUUU92UFR3UGVhRGRGb3NxUDdIbFlsWkVKZTRMR191aHIxR1gzdm5WUFMtelNUY1pOQ083TFoteURaUjd6?oc=5,2023-05-25,"Flash loans, flash attacks, and the future of DeFi Bank Underground",N/A,flash_loan,flash loan,{},2026-03-06 15:08:50
news,Google News,"April’s Crypto Scams, Exploits and Hacks Lead to $103M Lost — CertiK - Binance",https://news.google.com/rss/articles/CBMiWEFVX3lxTFB6azRJNzdvbm4wVDFoblZsN3puZUJFb0FSUUZSOG5Sd1VXcmxjak14WElrSTJpcmFXakwzWFFzbFNQM2RfN252UWl5WlRRd0hhN2JTczM0eWc?oc=5,2023-05-01,"April’s Crypto Scams, Exploits and Hacks Lead to $103M Lost — CertiK Binance",N/A,unknown,exploit,{},2026-03-06 15:08:51
news,Google News,Euler Compromise Investigation - Part 1 - The Exploit - Coinbase,https://news.google.com/rss/articles/CBMihgFBVV95cUxNVVN3NkRrS3ZIdVNUaWtWbjVUTS15bkxsS0JPd25hUVRxVk42ekVaTGtWN2NSYW0xZnZTSnJYWVBrSHE5b3EzSm1IckF6Z1kydVNlMk41M1VKbWo0UWFwOERYUzRPREdET2xfZF9TRVJqVE11N3ZNVUhIUVpkQnAxenRnOEROdw?oc=5,2023-04-19,Euler Compromise Investigation - Part 1 - The Exploit Coinbase,N/A,unknown,exploit,{},2026-03-06 15:08:41
news,Google News,SushiSwap Smart Contract Bug Leads to $3.3M Hack - Blockworks,https://news.google.com/rss/articles/CBMiYEFVX3lxTE5JUHUwNHU4THRsX3UtQ1V2R01UTTM0NmFUSnNJZXZUcXFyaGNTejN3V2Y2Yk1Hb1BmVzdsRDlUZDY1WjFMWnpnZDZEcmdISjV1QndMZllyQXlaMTJjVS1weA?oc=5,2023-04-10,SushiSwap Smart Contract Bug Leads to $3.3M Hack Blockworks,N/A,unknown,smart contract,{},2026-03-06 15:08:38
news,Google News,$197 Million Stolen: Euler Finance Flash Loan Attack Explained [UPDATED 4/6/23] - Chainalysis,https://news.google.com/rss/articles/CBMic0FVX3lxTE1zclM3LVZkTlFHYktOVXFxWnpiRzFLTk55TEZNUGlIc3dCTFpXSWJ6TklNZDdIeDEtd0FhQXNCS3EwQjJwRXQxSUJUeVNTdzlOWGZCNnc2TWdxdGlEMy1McmpObmxaWkpMOWF3aEpMbkQ2SEU?oc=5,2023-03-15,$197 Million Stolen: Euler Finance Flash Loan Attack Explained [UPDATED 4/6/23] Chainalysis,N/A,flash_loan,flash loan,{},2026-03-06 15:08:45
news,Google News,Poolz & Euler Hit With Back-to-Back DeFi Exploits Totaling $2.3M - BeInCrypto,https://news.google.com/rss/articles/CBMimgFBVV95cUxObzExMkhXMlFfMmdQN251cnBTdW1BdTFzOTRnQjc0aUJXbnZVT2NwR3VIRkt6aWtDZ2x5SFVQdHE2SHVfemZvV3FrSjAwT0xOeUp1UkR4a2hDQ2F5Y3JDTFlhX20xODVKMzlhSXhPdVcyWEhTU1dfV1lveUdlRTYzUTFsR2l2TG1XLXN4VXd5TzNPcVVaMjVpX01B?oc=5,2023-03-15,Poolz & Euler Hit With Back-to-Back DeFi Exploits Totaling $2.3M BeInCrypto,N/A,unknown,exploit,{},2026-03-06 15:08:53
news,Google News,Euler Suffers $200M Exploit in Flash Loan Attack - Blockworks,https://news.google.com/rss/articles/CBMiY0FVX3lxTE9jMzlnd0pvX0dKWHBKeUZDS2V3UE95TWZxaElDQ2ExZUR1UHBfbTBMblRKbXF3cVFJNUlEVG5MNVd6NzhUWUVyOW8zRG1tMFhnMVQxSXAxWXBoMDZ0cEdybHFxRQ?oc=5,2023-03-13,Euler Suffers $200M Exploit in Flash Loan Attack Blockworks,N/A,flash_loan,flash loan,{},2026-03-06 15:08:50
news,Google News,Oracle Manipulation Attacks Rising: A Unique Concern for DeFi - Chainalysis,https://news.google.com/rss/articles/CBMid0FVX3lxTE5wNGRERGF0TnQwOGlRMThzVTlodThEVzNpcmxBX3ZqcXd5U0haYVhLbEliSXVhNERTNjBpM1V1c0pIc1dOV3Z4RWFrY3FmUjlNSC1pN1NaRHJZWlU1Q2x3XzlTcjFRMWQ4T3FudnFYZHI3eEtyS25R?oc=5,2023-03-07,Oracle Manipulation Attacks Rising: A Unique Concern for DeFi Chainalysis,N/A,oracle_manipulation,oracle manipulation,{},2026-03-06 15:09:00
news,Google News,"After Suffering Second-Largest-Ever Crypto Hack, Jump Crypto Recovers 120,000 ETH By Exploiting Smart Contracts - Forbes",https://news.google.com/rss/articles/CBMigwJBVV95cUxNZEFGMkFPZTdjb3FLVE1RR0lFNDdGSWhqSEROYkwwanJId0Z4SGppYWpjZUx1TkNubWN6Z0o5dkVJLWY5cmR2ZWZNdzZURTFELUxkUldvR3hBd0doN2ZmU1ZDb0o3cEV0YVVEQldaZktjTXp2bExGWmZOZVRqNWJqX1h4Ul90WUtSWW9SX0ZTaUUyRnhQZzNlanNybW8yRXRaZ2RaOFBIbG90OFNoSWEyLWFTQ29iWXR0dm52bktxX2dkT08weGFrX1h5cnllNzd3V2F3UXluVHMtLWl0alBWMnpNZHlZTExKNFlGX1BGX3BFcGU4ZC1HeTc1YlpQTzhSaG5Z?oc=5,2023-03-03,"After Suffering Second-Largest-Ever Crypto Hack, Jump Crypto Recovers 120,000 ETH By Exploiting Smart Contracts Forbes",N/A,unknown,smart contract,{},2026-03-06 15:08:38
news,Google News,Jump Crypto Just Counter-Exploited the Wormhole Hacker for $140 Million - Blockworks,https://news.google.com/rss/articles/CBMibkFVX3lxTFBvb3JsRlN1OFViZDNHX2RNR3FHYkVyR1M3alhNVk1KVDBva0VzUms1TFNYbXBITkxnemVqYmRpblRYc1loc1J5c1dJYkRuMG83YkFOaXNxWFVJelo4WWQ1WUN4RXdzbUVfOE5HWi13?oc=5,2023-02-24,Jump Crypto Just Counter-Exploited the Wormhole Hacker for $140 Million Blockworks,N/A,unknown,exploit,{},2026-03-06 15:08:56
news,Google News,Platypus Protocol Loses $8.5M in Flash Loan Attack - BeInCrypto,https://news.google.com/rss/articles/CBMibkFVX3lxTFBqNklYNmFsQThXTUxmV3g3bk4tZkRWNjRsV0Z3LV9Va0RtZEdOTVJ5cFhlQ0FlZFpaMEhHbFdNcTFBWlFORUVXQ1V2aS0zTl9vREptTVlUdDFtMDdJdXFUeUJrNzlzZU5TbF95a2J3?oc=5,2023-02-17,Platypus Protocol Loses $8.5M in Flash Loan Attack BeInCrypto,N/A,flash_loan,flash loan,{},2026-03-06 15:08:51
news,Google News,Decentralized exchange Orion Protocol hacked for $3 million - The Block,https://news.google.com/rss/articles/CBMimgFBVV95cUxQSWRENVI1dFlTMTJXcENfQ2FOaGg1d2dGandJbWIzZ29iYzZ6ZG5uZ05TYTB0VTM3ZjBlbjE4VEozWF85bWFieVBCbGZHNlk1S3VEWWRuRGNqM0hqLUtiMHBXdWxGU2F1VEVFYWo4UVZWOWFiampETkkxS1JvZlBQUDJnMHIyNDhjRFZBbExYWU1TWW1FbFdBZWd3?oc=5,2023-02-03,Decentralized exchange Orion Protocol hacked for $3 million The Block,N/A,unknown,protocol hack,{},2026-03-06 15:08:38
news,Google News,DeFi hackers stole $3.2bn last year amid 35% surge in ‘bridge’ exploits - dlnews.com,https://news.google.com/rss/articles/CBMirgFBVV95cUxQeVhVQ2JGV2J6bExyQ1Z3eFF1VWt4aWFuTENZV2xUV2JFb05wOFNHY2xUdkNoXzdhN0VaY2RYMHVXRDVtQ2FTRjJKLWZsQ1ZOWl9rek9Xc1FHMU0xUjZVTTUzWFp5RXhQMWtjNVlWcmxGeVd0anFLQUlWRF9pei1XNWU1WTJfTVN4UDlhVUVTZVpUTk1qa21qRkhsQ0Q3cFBkVk5COUM2OVVIcW41TlE?oc=5,2023-02-02,DeFi hackers stole $3.2bn last year amid 35% surge in ‘bridge’ exploits dlnews.com,N/A,bridge_hack,defi hack,{},2026-03-06 15:08:45
news,Google News,CFTC Partners with SEC and DOJ to Bring Coordinated DeFi Enforcement Action Targeting Oracle Manipulation - Jones Day,https://news.google.com/rss/articles/CBMi5AFBVV95cUxNV19qZ3ZHOEJMZmtOdDZycUZNSUdrZ25RZ3Y3em9VbHdFbDZ5alNPc0VLNjdmaEx6VWRCTi04R3h6T283WkJpcGxGNjE1VENSNDZWYkcxdFFmOWNDbGJQdW5oZzVMUTRGZGZ5bERyZnFJTTNzWG1oT1FPU1Nwc3pvX0VtaHRseElWT05NcTJ2WXVtMTBPZ3A0X2d2QXlqRFVNS245eDZMVFMta3E3cnpSNW94MjVPMXhPUTJMamZVRXlEanpOUFQ3a2tGc0IyaEtiX09kS0N6b3NFbE5sdkFLY3lDQno?oc=5,2023-02-01,CFTC Partners with SEC and DOJ to Bring Coordinated DeFi Enforcement Action Targeting Oracle Manipulation Jones Day,N/A,oracle_manipulation,oracle manipulation,{},2026-03-06 15:09:00
news,Google News,FBI confirms Lazarus Group and APT38 were responsible for $100 million bridge hack - The Block,https://news.google.com/rss/articles/CBMiuAFBVV95cUxOeVpfbjRfQ3p1WVlxa2V0MUs5a1J4UmlKU1FWblVsX3RTcnp2enhHSThrWmhTUVhmSW1yVFhYUkZFUjlrOXFuUHVJeEgzTFFVd1IyWmprSW1ZOURWbWxra29UejN1MXI2QXBMbUUtUmp0bjVWQXUteUFpcnBhNEYtVzlpNnMxZU1MdWxCWUotcW9oLWV3SUF0bWFWRk9OR2VMNXN4akFNT190cTY3UXNTb2FjNlZqN0VZ?oc=5,2023-01-23,FBI confirms Lazarus Group and APT38 were responsible for $100 million bridge hack The Block,N/A,bridge_hack,bridge hack,{},2026-03-06 15:08:56
news,Google News,3 Ways to Prevent Reentrancy Attacks in Smart Contract Development - HackerNoon,https://news.google.com/rss/articles/CBMikwFBVV95cUxOMS15X0RrUTl3aHcxNUZiY1ZVeGhqX0szeGpPSy1yVlI5ODVvT0tBajgxSk1UcnpqVXpwdFZjV1VFVlBZNFN5NHl1WGxjZkZWdk8tZmtQX0VSQkhTRVlWSG9CZ3dJRHlaYjFFb0lxdTFhZERHaExLTzRmVXpMODB2RnlqTTFyYW5kNkNLVmxwTjZqNEU?oc=5,2023-01-19,3 Ways to Prevent Reentrancy Attacks in Smart Contract Development HackerNoon,N/A,reentrancy,smart contract,{},2026-03-06 15:08:47
news,Google News,North Korea's Lazarus Group Moves More than $60 Million from Harmony Bridge Hack - thestreet.com,https://news.google.com/rss/articles/CBMivAFBVV95cUxNdTZzQVNaQVRTdHFqdWRGeFd6Rk1Fc1FJRjU4Vkp0UmpiUjFxZ0lIRlVHY1RsS3YteE9TY3lkeWZ6N1NfaTFpLTVwcHFKZ1k1eGR4YUtiZzFzT0RlZEt2UkVSdkNGcDMwMXpVeG9vQXNuMGl2Vjk0d0dHZVBLYmsxVTFpUFJmZlFxVHZSNC0xZER6RUZrTC1FRnBxT2dJRkRtUVVOMElpQnBJZVM0cUtfanNRM1V0ZFBLSmg3Zw?oc=5,2023-01-17,North Korea's Lazarus Group Moves More than $60 Million from Harmony Bridge Hack thestreet.com,N/A,bridge_hack,bridge hack,{},2026-03-06 15:08:56
news,Google News,"DeFi, Cross-Chain Bridge Attacks Drive Record Haul from Cryptocurrency Hacks and Exploits | TRM Blog - TRM Labs",https://news.google.com/rss/articles/CBMixgFBVV95cUxQMHEwMGMxZ29CTDVoX041RTJRWVN4cEF4OW1QMVUxY0NSYmx4VlpYSkRhb2t3RjdvZGV3MW9TVEdjSWpwOURUQndSaXBYWWpzdWN5VzFDemtCeUVzaHpYdWhyTnpDaklJUjY1aWN2LWVYUjJnWVhPVnB0eVBHeUlueW9QeTB4cTNkbFNmODZDVEFUUXZ3VVBRSElqemxsdlk0TXBUeEhrUnRsUmhmXzBnbTRrM05DQ2VwMlFsZk1zbkljM3ZzVWc?oc=5,2022-12-15,"DeFi, Cross-Chain Bridge Attacks Drive Record Haul from Cryptocurrency Hacks and Exploits | TRM Blog TRM Labs",N/A,bridge_hack,exploit,{},2026-03-06 15:08:38
news,Google News,Crypto Hacks & Historical Cryptocurrency Exploits - Milk Road,https://news.google.com/rss/articles/CBMiQEFVX3lxTE96SGt0eU5UWlRjX0hnbTloZGNkZlpGWjktX1ZxVzlMVVVZenNCb0xTczFTT2hHczdaQV9ROGVDWG8?oc=5,2022-12-12,Crypto Hacks & Historical Cryptocurrency Exploits Milk Road,N/A,unknown,exploit,{},2026-03-06 15:08:38
news,Google News,Decentralized Robbery: Dissecting the Nomad Bridge Hack and Following the Money - Google Cloud,https://news.google.com/rss/articles/CBMijgFBVV95cUxQN0R0R29kRlRpRkdVVnN2RUhNdDJua0k2X00teWNVQ2Q3NFZpQnFLaWZ5ZDBWWk43SFpoOV9sYmtCTk1qbTNXR21aSzI0MHJWTlhHRlgyZHcwT0JBalhmQi1IU1FfSXNBUl9Xa2toc2JkcTNFVG9iY2c5VzdUWDRhNTZhUGR1bHYwLTJjMV9n?oc=5,2022-11-29,Decentralized Robbery: Dissecting the Nomad Bridge Hack and Following the Money Google Cloud,N/A,bridge_hack,bridge hack,{},2026-03-06 15:08:38
news,Google News,Harmony’s Cross-Chain Horizon Bridge Hacked for $100M - Blockworks,https://news.google.com/rss/articles/CBMif0FVX3lxTE0yaWNia2o0ellDRkpEbVlhRUhmdlhsV2tKU2k1RHRwTURaX0I3a0IycVNwbmlSeTRFQl91NUFtbXVLdGdLNVhWS0d4czg2T19FQ3FNS1BBd2dSU1hUVjBZNEdoN2FTOG9HNEZ2TmFOcW15VC1yQkR6UW9ZaXkyNFk?oc=5,2022-11-20,Harmony’s Cross-Chain Horizon Bridge Hacked for $100M Blockworks,N/A,bridge_hack,bridge hack,{},2026-03-06 15:08:56
news,Google News,"In Second Largest DeFi Hack Ever, Blockchain Bridge Loses $320M Ether - Blockworks",https://news.google.com/rss/articles/CBMimgFBVV95cUxQN1NILVFKX2c5SFBFMTcteEpzSnBDbnB4THBsTzdYUWxBcEtDbEUxdFRhTW1ENVhpSmpIMk1tUVlfN3dIT0t4V25oOFR0SlJJeERwUkVkWnFHUE41ZE55c2FpZlFFLUREUjd0ZF9CVHo5eWIwQVEtQnVLYlpMR3QtUTY5eW00ODhCNW94MHl2RGpfYkdWandmT1RR?oc=5,2022-11-17,"In Second Largest DeFi Hack Ever, Blockchain Bridge Loses $320M Ether Blockworks",N/A,bridge_hack,defi hack,{},2026-03-06 15:08:45
news,Google News,Mango Markets Mangled by Oracle Manipulation for $112M - Blockworks,https://news.google.com/rss/articles/CBMihwFBVV95cUxNa2V1Tk8yT2dLUTFEMDdsRkdqRTcwVmtJVFBKLVdsa3hERjUwUk5BY0FPYXotaVlTeVNoTWJhTkhsQTZwS2VSU2JVTkRjd0k5OW5iaU5ZN0dtd1VUN1owR0RuT1NHQ3NQX0JNUmtPYUhvcXI5RXVPSHpxaHdGMUdTMUZGZVVfS1U?oc=5,2022-11-17,Mango Markets Mangled by Oracle Manipulation for $112M Blockworks,N/A,oracle_manipulation,oracle manipulation,{},2026-03-06 15:09:00
news,Google News,BlockSec Debunks Rumours of $532M Smart Contract Hack - crypto.news,https://news.google.com/rss/articles/CBMifkFVX3lxTE05VHgxSWZNX0ctUDRtel9RRlF6NE42SjZnZ0hmZk0wVlpGSUhyN2V6UXBMQXpZSGRCVk1zRU5FMDRpdXlYRWVVREt2NnZSay1aMmRnZjFFd1RGWVh4dmxPTEszTjFBTHhGX3pCaVU1MzVBaUczYXdMNGNTNWE1dw?oc=5,2022-10-31,BlockSec Debunks Rumours of $532M Smart Contract Hack crypto.news,N/A,unknown,smart contract,{},2026-03-06 15:08:38
news,Google News,Smart Contract Bug Hunting: Top 7 Strategies - Chainlink Blog,https://news.google.com/rss/articles/CBMiYEFVX3lxTE82OHFQSzd0N3VzVDIxR0xEUXhaVjVhX2V3bFVPcnR3Yk0zbXk4ZFZqUE9WZ25Jc21kTE43NTREZnl2XzNDX0I0UGgtMGxXcXZjWEhYaTNReXg0UE1TZVBCZQ?oc=5,2022-10-26,Smart Contract Bug Hunting: Top 7 Strategies Chainlink Blog,N/A,unknown,smart contract,{},2026-03-06 15:08:53
news,Google News,How Flash Loans Have Become The Bane of The Crypto World - BeInCrypto,https://news.google.com/rss/articles/CBMihAFBVV95cUxOcW1tTEJoWkNTdUVSSmV3YnpBSTNXWFBOOFJqV0N3ZEM4aUdreFp2bVZ4aDNGUTJkN05ES3ZvcGlieFJyV3VCN2VaakRoTm1Xd2dObzZsUTM2MTBqY1FvUzJidkRxX0pfa2J4bFdvU2pUdm02a0VxOTVKZlZleElURURFMjI?oc=5,2022-10-25,How Flash Loans Have Become The Bane of The Crypto World BeInCrypto,N/A,flash_loan,flash loan,{},2026-03-06 15:08:51
news,Google News,"DeFi Lending Platform Built on Polygon (MATIC) Hacked for $220,000 in Flash Loan Attack - The Daily Hodl",https://news.google.com/rss/articles/CBMiuAFBVV95cUxQOExPRGtWZzhwMDlkLUlEUllybzB3c3N2QWxmS0RDUWxYX2EwWFptWU1ZbWZlYnNMZ2owQWdNdFZ2NVhpaEw2bXR2dFlfRFRwNHZiVi1RMENuZ1ctVVZWcWhvMlFXS3F0bnc1bmVtUFd1WC1kT0NxRG03Tjl0MnBzRGNRbjFJSnRIWVdBVzdhQmwwb1NFcWpJYzE5X3NCMDVmNEI4bXNGRHk3WnJuYnFlSXZhRnZIZXRi0gG-AUFVX3lxTE1iTnlNeE5hMGVpWFFXd3V5eDJHYko4aXloM3FBS3k4amIwbWdZd2lKdjVjZ1JaSy16aVBwV0xGWjUyVi0zNmN2elZtSjlsV2lLeEtnSFp1S3RqTjRxaHdOWXZSbGtTSXdXcUtzdzZHVWd0Qk4wRWtOTWpibjcyZVhOY0FQaFFydURISUpYMEdERHBRSlRkdE9qR0VIVEF6OVd3X2E0UDk2NDliRFZMMzJrWE9jRTF3NHR4SlJPb3c?oc=5,2022-10-25,"DeFi Lending Platform Built on Polygon (MATIC) Hacked for $220,000 in Flash Loan Attack The Daily Hodl",N/A,flash_loan,flash loan,{},2026-03-06 15:08:51
news,Google News,Binance loses $100 million in a bridge hack - waya.media,https://news.google.com/rss/articles/CBMib0FVX3lxTE0tZm8wSE81VlZxcGIwNnoyb0FmQnY2c3RqV3BBaEdOTENTajRHNVhvRndmTXJjdlNxd0xZZFIwQWJrQzNycm80Q1ppVWxHOWp4RmpONWd3dW0yZjlfMnNvVk5Cc1hlZUpXcS1UMVFnUQ?oc=5,2022-10-09,Binance loses $100 million in a bridge hack waya.media,N/A,bridge_hack,bridge hack,{},2026-03-06 15:08:56
news,Google News,Binance hit by $100 million blockchain bridge hack - TechCrunch,https://news.google.com/rss/articles/CBMiaEFVX3lxTE9LOEFzUGNlbW02LXppdFBZdHFhS3lTWlJPdWdoTWlQS2dFOVlYeUgzWmlVLTNqYnp2YVhDX0MxeFExTEJPU0s5WGltRndnVzBBREowUWVISmlwelNycnFlSkpWTW5fTVpy?oc=5,2022-10-07,Binance hit by $100 million blockchain bridge hack TechCrunch,N/A,bridge_hack,bridge hack,{},2026-03-06 15:08:56
news,Google News,Binance Hit By $570 Million Blockchain Bridge Hack - Investopedia,https://news.google.com/rss/articles/CBMiZkFVX3lxTFBZNzJtTWEzakxFQlE4ME9vQW1SQzZHcDJfTnFVZ0dsRDc0WTdCeVMxZGpRS3JCTUhrTFBiU2gybHVjeVdHZk5iYjRCWE1qcVFwbWVpSjU0dENybXpQdkViUGpEeEl3dw?oc=5,2022-10-07,Binance Hit By $570 Million Blockchain Bridge Hack Investopedia,N/A,bridge_hack,bridge hack,{},2026-03-06 15:08:56
news,Google News,Crypto market maker Wintermute loses $160 million in DeFi hack - TechCrunch,https://news.google.com/rss/articles/CBMinAFBVV95cUxPVjBLaS0xX01uZkMyY1k3enM0STBsVnN2WWxkT2FVa3l4dUlwX0hibUgyc1c2TVRHLVduMlREbHhPUFgwOVJwRHNzazl2ZXpzbm1qSzd4VnlrUGVjRi1MOVVJZng3Y1c4a19JNFFfRmNVd1lVZk9ncHZ0cTlDckhhOFRRUEc1dUJlS1hZUzJfVHFvWG5lSjRUT2F0aVk?oc=5,2022-09-20,Crypto market maker Wintermute loses $160 million in DeFi hack TechCrunch,N/A,unknown,defi hack,{},2026-03-06 15:08:45
news,Google News,Nomad Loses $156 Million in Seventh Major Crypto Bridge Exploit of 2022 - Elliptic,https://news.google.com/rss/articles/CBMirAFBVV95cUxQVFdxcGlxQ0pldmJPTTg4MUxtMXZoMG9vVTV2TGd5TGwzX014VEYxUW12UWNzVzF5Y3VqX1dOMVFaV1F5SVdxams4NlVHX0dlVVBLNEhMQmFWeTNNREVVdFdqaUVXMFRRdW5DNnB5YWhQVjFQQzVBOWxURGowbHNWc1lkNU5oR3RrRnFTeWNZVVozcTd1X1VNbjI4eV9OalhxUGNpNWJfWXJfU1NE?oc=5,2022-08-03,Nomad Loses $156 Million in Seventh Major Crypto Bridge Exploit of 2022 Elliptic,N/A,bridge_hack,exploit,{},2026-03-06 15:08:56
news,Google News,Nomad hack: Ethical hackers return $9 million to exploited crypto bridge platform - The Block,https://news.google.com/rss/articles/CBMitgFBVV95cUxQb1F1NVUzVHE2dG5IOWgzZ0hIZGc5RnBrY3ZVeHNZbk5rTWhTWmQyMko3VEprUVI3eVdjZklyd0FIeHNQUndTOE5CdThYUkFEdEw5cjY4TnhRLVVDdDlIQkoyalZuTUtNX0pURTBUUHlGOEg0WldqUy1WdEZPa3FXcllsSExOZGY2Zndta3Z0THlZMzQxOEV6OXhUT2dhakZySG9JWEdEUmx3WEJBdFNXVkZpVFE3Zw?oc=5,2022-08-03,Nomad hack: Ethical hackers return $9 million to exploited crypto bridge platform The Block,N/A,bridge_hack,exploit,{},2026-03-06 15:08:56
news,Google News,Nomad's $190 million bridge exploit drew hacking feeding frenzy of 300 addresses - The Block,https://news.google.com/rss/articles/CBMitAFBVV95cUxNN3QyRnJMWFMyOEsxMDZ4V0xVS29veXRCZExCQlpmUkNBUUdPUm5nN2pQRFVzdzVGY3AyZVJJbzdlV1hMTDhIRWh2RDdRc2IxZ3RjMlBGMUNTQWUwSEVIUXJVWEo5dXVrZmg5V0lEZ0lyempSakJCcEg0UF9taWVjQVF6MjItbnN5eVpPd1VWV2c2UkUxX0dfbnhuWW0tY015X3NkUloyNFFmMUtnVHVQNXJkSXk?oc=5,2022-08-02,Nomad's $190 million bridge exploit drew hacking feeding frenzy of 300 addresses The Block,N/A,bridge_hack,exploit,{},2026-03-06 15:08:56
news,Google News,"1,300 ETH Stolen from NFT Lending Platform OMNI in Re-entrancy Exploit - DailyCoin",https://news.google.com/rss/articles/CBMilwFBVV95cUxPTjRTLVVjVXFzclZJcnhpN0EwRUprMFRRdk1STFFKSTNqRkZRZXZWWG9sdUgtclFKWERKSkhtZkpLcnV1TW5CY0xXQ2F0dkxMQndPTUtPVzRZbjhZU0pmMkg1LUczUUVkV0xBTUg1alFyN1VPWlNpRkgtZVJRSmRCTG92UGhuVnlmMHFzNDZqZnRtaHdZekhN?oc=5,2022-07-11,"1,300 ETH Stolen from NFT Lending Platform OMNI in Re-entrancy Exploit DailyCoin",N/A,reentrancy,exploit,{},2026-03-06 15:08:47
news,Google News,"Hacker exploits Harmony blockchain bridge, loots $100M in crypto - TechCrunch",https://news.google.com/rss/articles/CBMic0FVX3lxTE5pdjVzdEhnSl9EdlE3RHkwOE54ZVU1NS1hc3lzRmY1bVdaOVhBeVR5cjlRMi1FQldkVXpWX3pvTE81Y28xRXY3Wm4tSzByZGlHYmwxU21Va2h5aU1kV3hGeHhVdlBMdjlhd1MyZGxrbUVNMDA?oc=5,2022-06-24,"Hacker exploits Harmony blockchain bridge, loots $100M in crypto TechCrunch",N/A,bridge_hack,exploit,{},2026-03-06 15:08:56
news,Google News,Hackers Steal $100 Million by Exploiting Crypto’s Weak Link - Time Magazine,https://news.google.com/rss/articles/CBMiakFVX3lxTE9pOUJtNDJTMkhYdzRJQ2JzYlVoRDNEZWZjaG50VlNwY01KNUxEN09aU0VHNmoyNmIxb1FEUUlEcVg4OEVkX3dPZDZwWlJHRWRnQU1sZ2JJQXVFUkRxSGVKb2hUU2ZySEQwSkE?oc=5,2022-06-24,Hackers Steal $100 Million by Exploiting Crypto’s Weak Link Time Magazine,N/A,unknown,exploit,{},2026-03-06 15:08:56
news,Google News,Inverse Finance stung for $1.2 million via flash loan attack - theregister.com,https://news.google.com/rss/articles/CBMibkFVX3lxTE9DN2VISEdudTlaMW56aExsdTI5M08zQXZSWE5DbENJY2tVaks0TFRqRU01R3BwY2xHN3ZKekEzbVZkd3dCdDFSeGVKR0FtUnNvT2NGWllYZERfN1VCbkFBVUsxVUJWT0FmQmZFVTZR?oc=5,2022-06-17,Inverse Finance stung for $1.2 million via flash loan attack theregister.com,N/A,flash_loan,flash loan,{},2026-03-06 15:08:50
news,Google News,Inverse Finance drained for $1.2 million in a flash loan attack - The Block,https://news.google.com/rss/articles/CBMinwFBVV95cUxQRFhld3NOVkJpdU9pOE0xVDFGMDVOWm9VaG1NQjY2SjIwNFJZWTJZbVRUaTdsbUhJU2U0eXdfSU1ZYXpaLXhVU1pPYUw1N0V3anh2dlZ6WXZwU3N1SGQ5SDZWOHp5Ui1ELTFCdTByY29ra3FQNUV2TXBxX0dIYVFzWGZ4aXEyMWhlTG56aGYwQU85eHlHQWVtT29ra2pxRmc?oc=5,2022-06-16,Inverse Finance drained for $1.2 million in a flash loan attack The Block,N/A,flash_loan,flash loan,{},2026-03-06 15:08:50
news,Google News,DeFi Hacker Steals $13.4M in DEUS Finance Attack - Crypto Briefing,https://news.google.com/rss/articles/CBMifEFVX3lxTFBSV1ltc3VQeFlBczh3N19WTUpGaVFQZFNoM2JXUEphazY5UERqZFB6dHV0dXY3TEhTbVlFS2t5MTgyQUtxX3hCU3I2Sy1HVHZvLUVsMEdSZE1ibHNWbUtRTUF1bHJKUm81ZERjX08tQ25fTTJLRlVXbWNPd0k?oc=5,2022-04-28,DeFi Hacker Steals $13.4M in DEUS Finance Attack Crypto Briefing,N/A,unknown,defi hack,{},2026-03-06 15:08:51
news,Google News,What are flash loan attacks — the phenomenon behind the latest $182 million hack - CNBC TV18,https://news.google.com/rss/articles/CBMiywFBVV95cUxPU1VBckFYUDFCVUdJdWxyQVlvVnlrZENXQUtUOVFfQ2M0TzVNRnhBYVZiMzA4MjhneER4MjdZVVBoYmNZSjdQNmpoMHpiQ1RmUzZNNlJ0aHNEOXJUTjhQMGpSTnFBR0FXdl9tY182WUJHbWJvb3RVcEI2Q2FOcVpsZzVYcUVycFN0SDE4MTloclY2M3k4NmxYUHFERGliaXVuc2F2OUU3YVNzQnZQdkFGQ1ZrZlVYR09NVTUzYlZqaWhlbmw1MENDNmd0VdIB0AFBVV95cUxQTGtEa0xSSzNmYUFPQ1hpQ3Y3eW1DVnlCaF9RZ1ZJcTBsSjdESWxCNXlwb1FNRWV2X19vOUhhbllmbkxsRS1RampzU2FQR0ctTW92UkNWaG1Ya2RTMzR5cWhkWkFIVXdkdVdKczNDN21RT1I4dDMwV25kY0RGLVBtelhaNmhXT3pjQXBXUmlfNmMtVVdpaXQwSHJkSVFBY2JLZ3BpSDRYSTRpZld6ODR2bTBvVmo2aVZKZ2VKbG1XOXJ2SXQyaDRsTGttc3RUcUE3?oc=5,2022-04-20,What are flash loan attacks — the phenomenon behind the latest $182 million hack CNBC TV18,N/A,flash_loan,flash loan,{},2026-03-06 15:08:50
news,Google News,13 Biggest DeFi Hacks and Heists - Decrypt,https://news.google.com/rss/articles/CBMiX0FVX3lxTE1XVkl0cUlqR2hJellSYl9scDZyRGQ3T29vV0F0M185NjJCbGNWSEhJSDdzenZIc1hWbURUM3lEMFhyaThhNng0RlBqMUtGanZuSUlFOGYtVVk5RHB0VFJB0gFnQVVfeXFMTnBTd2hsRWd5aUhTVmdPRU1KWFRUSkJuM0QzRWUwcjlNak5OY3ZUNEZHN2VPRTFuNFQ4MWZIcWhDanNKQ3A3aUxQS0RMMWRXS1VHOGVzQnpqVnRwNXVxY2tsYUFJVkFCQQ?oc=5,2022-04-18,13 Biggest DeFi Hacks and Heists Decrypt,N/A,unknown,defi hack,{},2026-03-06 15:08:45
news,Google News,Stablecoin Protocol Beanstalk Loses $182M in Flash Loan Attack - Finance Magnates,https://news.google.com/rss/articles/CBMitAFBVV95cUxNSG1PaE0tQjNwTXA4a0lUb2FEamNoTFdUR05QdlBHZ2R4MWdNbE8wQ1JEb0dvYWV0RlhGdkF4NHF2OTdtZUpxVHVGS2xoblM2Z1ZEUTVZYktUenVnWk9NUjE5Wk4ybXhoY3pIRnhNLWFZV2xrVFB3TE9WenhSMG9WTXJfZDVMdHpydkVvYWJ0cnd2OXAxMGZJME5nZ3ZJUmI0SVNtbEsydUx2UUlGcDVZSEhrMUTSAboBQVVfeXFMTWxQQjJ1OV9QZ21saExfcDI4SWFsaHB2Z2c3a0liVDFXYzJPdG5QeFRtYVVfeG5PdVFJYnFSSFUyaTJ4QzF1SVd0S2tYbjRzMVZuZ0lxaUpyRGtMOHVUOVdyWGxDSXJxRlNRUURvNzFIbmFWdE1aaHkzN3FOMGowNGNQandxT2pkaHhmNDREbGdUb3E2NURtYzhaQmpOUndUeHR6d0ZJNTdzNURVNVNId2ZUU2hVT0xHOTJB?oc=5,2022-04-18,Stablecoin Protocol Beanstalk Loses $182M in Flash Loan Attack Finance Magnates,N/A,flash_loan,flash loan,{},2026-03-06 15:08:50
news,Google News,$182 million stolen from stablecoin provider Beanstalk Farms in ‘flash loan’ attack - SiliconANGLE,https://news.google.com/rss/articles/CBMirgFBVV95cUxNWGczR1FyQTU5R05OaDBtRnlkZllkVTR4emh6VnVoWmIzY2NFc3l2LWZMQXktMlNxMjFWaGlEUGJjV2dYenhjN3NXYmxPX01iazJCV2JQcXhmMDlvc09wNHgxVG1MLVE5X3hjdjRSMTJuaHRMdUZnd2gyWTJXZ3pNTllZbk9PQUw2enBUT245aFJCNWtJNF9aRkVrNEtDYnF0QU8yY2NkZDNSNEJ6c2c?oc=5,2022-04-17,$182 million stolen from stablecoin provider Beanstalk Farms in ‘flash loan’ attack SiliconANGLE,N/A,flash_loan,flash loan,{},2026-03-06 15:08:50
news,Google News,DeFi Hacks Are Stealing More Crypto Than Ever Before - Chainalysis,https://news.google.com/rss/articles/CBMiXkFVX3lxTE9qRE1WamMwWm96WUE0Y3dRV2JrZDFDZ05wZ3JyVTVBTjlWYXpGUVFKdk1FaFpzd0FWbHduX2JBVmw4VnNmdjBEZklqY1FiUHdjbkxTLVRuRHMtaHppQnc?oc=5,2022-04-14,DeFi Hacks Are Stealing More Crypto Than Ever Before Chainalysis,N/A,unknown,defi hack,{},2026-03-06 15:08:45
news,Google News,North Korea’s Lazarus Group identified as exploiters behind $540 million Ronin bridge heist - Elliptic,https://news.google.com/rss/articles/CBMif0FVX3lxTE1RVlVxLU5MYnU2eDUweUF0QWRPTmtNNWlGbGFGWEdJal9ub29lR1lSbjlvS1piMmZwaE12ZVFLdkNsSjVXc2JqU1pPRGRSMjdPU0ljblFKalhPek56RFdnX0xBQTAzOWdKYnIycjJJOGJNcVJVc01US3pXU1hReGs?oc=5,2022-04-14,North Korea’s Lazarus Group identified as exploiters behind $540 million Ronin bridge heist Elliptic,N/A,bridge_hack,exploit,{},2026-03-06 15:08:45
